drop table if exists t1;
NOTICE:  table "t1" does not exist, skipping
drop table if exists t100;
NOTICE:  table "t100" does not exist, skipping
drop table if exists t101;
NOTICE:  table "t101" does not exist, skipping
drop table if exists t102;
NOTICE:  table "t102" does not exist, skipping
drop table if exists t103;
NOTICE:  table "t103" does not exist, skipping
create table t1(a int primary key, b serial) partition by hash(a);
create table t100 partition of t1 for values with (modulus 4, remainder 0); 
create table t101 partition of t1 for values with (modulus 4, remainder 1); 
create table t102 partition of t1 for values with (modulus 4, remainder 2); 
create table t103 partition of t1 for values with (modulus 4, remainder 3); 
insert into t1 values(1),(2),(3),(4),(5),(6),(7),(8),(9),(10),(11),(12),(13),(14),(15),(16),(17),(18),(19),(20);
select*from t1;
 a  | b  
----+----
  1 |  1
 12 | 12
 14 | 14
 16 | 16
 17 | 17
  3 |  3
  5 |  5
  8 |  8
  9 |  9
 11 | 11
 19 | 19
 20 | 20
  2 |  2
 13 | 13
 18 | 18
  4 |  4
  6 |  6
  7 |  7
 10 | 10
 15 | 15
(20 rows)

select a from t1 where a between 3 and 11;
 a  
----
  3
  5
  8
  9
 11
  4
  6
  7
 10
(9 rows)

select * from t1 where a in (3,7,11, 13);
 a  | b  
----+----
  3 |  3
 11 | 11
 13 | 13
  7 |  7
(4 rows)

update t1 set a=a+1 where a > 1 and a < 5;
ERROR:  Can not update partition key of a remote relation.
delete from t1 where a %5=0;
select * from t1 where a %5=0;
 a | b 
---+---
(0 rows)

select*from t1;
 a  | b  
----+----
  1 |  1
 12 | 12
 14 | 14
 16 | 16
 17 | 17
  3 |  3
  8 |  8
  9 |  9
 11 | 11
 19 | 19
  2 |  2
 13 | 13
 18 | 18
  4 |  4
  6 |  6
  7 |  7
(16 rows)

start transaction;
delete from t1 where a > 10;
select*from t1;
 a | b 
---+---
 1 | 1
 3 | 3
 8 | 8
 9 | 9
 2 | 2
 4 | 4
 6 | 6
 7 | 7
(8 rows)

create table tfail(a int);
ERROR:  Can not execute DDL statements in an explicit transaction in kunlun-db.
delete from t1;
ERROR:  current transaction is aborted, commands ignored until end of transaction block
select*from t1;
ERROR:  current transaction is aborted, commands ignored until end of transaction block
commit;
start transaction;
delete from t1;
select*from t1;
 a | b 
---+---
(0 rows)

rollback;
select*from t1;
 a  | b  
----+----
  1 |  1
 12 | 12
 14 | 14
 16 | 16
 17 | 17
  3 |  3
  8 |  8
  9 |  9
 11 | 11
 19 | 19
  2 |  2
 13 | 13
 18 | 18
  4 |  4
  6 |  6
  7 |  7
(16 rows)

drop table if exists t2;
create table t2(a int primary key, b timestamptz default now(), c varchar(32) default 'xyz');
start transaction;
insert into t2 values(1) returning *;
 a |                  b                  |  c  
---+-------------------------------------+-----
 1 | Wed Jun 02 03:53:35.160998 2021 PDT | xyz
(1 row)

insert into t2 values(8, NULL, 'xxx'),(9, NULL, NULL) returning *;
 a | b |  c  
---+---+-----
 8 |   | xxx
 9 |   | 
(2 rows)

insert into t2 values(10, now(), 'abc'),(11, '2006-06-02 13:36:35+08', '你好');
commit;
insert into t2 values(1) returning *;
ERROR:  Kunlun-db: MySQL storage node (1, 1) returned error: 1062, Duplicate entry '1' for key 'PRIMARY'.
begin;
insert into t2 values(1) returning *;
ERROR:  Kunlun-db: MySQL storage node (1, 1) returned error: 1062, Duplicate entry '1' for key 'PRIMARY'.
commit;
select*from t2;
 a  |              b               |  c   
----+------------------------------+------
  1 | Wed Jun 02 03:53:35 2021 PDT | xyz
  8 |                              | xxx
  9 |                              | 
 10 | Wed Jun 02 03:53:35 2021 PDT | abc
 11 | Thu Jun 01 22:36:35 2006 PDT | 你好
(5 rows)

drop table if exists t3;
NOTICE:  table "t3" does not exist, skipping
drop table if exists t301;
NOTICE:  table "t301" does not exist, skipping
drop table if exists t302;
NOTICE:  table "t302" does not exist, skipping
create table t3(a int, b varchar(16) NOT NULL, c int, primary key(b,a)) partition by list(a);
create table t301 partition of t3 for values in (1,3,5,7,9);
create table t302 partition of t3 for values in (2,4,6, 8, 10);
insert into t3 values (1, 'amd', 24254),(2, 'intel', 325332),(3, 'broadcom', 345220),(4, 'nvidia', 87902),(5, 'huawei',89790),(6, 'apple',45232);
create index on t3(c);
select*from t3 where c > 100000;
 a |    b     |   c    
---+----------+--------
 3 | broadcom | 345220
 2 | intel    | 325332
(2 rows)

drop table if exists t5;
NOTICE:  table "t5" does not exist, skipping
drop table if exists t501;
NOTICE:  table "t501" does not exist, skipping
drop table if exists t502;
NOTICE:  table "t502" does not exist, skipping
drop table if exists t503;
NOTICE:  table "t503" does not exist, skipping
drop table if exists t504;
NOTICE:  table "t504" does not exist, skipping
create table t5(a int primary key, b timestamptz default now(), c varchar(32) default 'abc') partition by range(a);
create table t501 partition of t5 for values from (MINVALUE) to (10);
create table t502 partition of t5 for values from (10) to (20);
create table t503 partition of t5 for values from (20) to (30);
create table t504 partition of t5 for values from (30) to (MAXVALUE);
insert into t5 values(-10),(0), (15),(40) returning *;
  a  |                  b                  |  c  
-----+-------------------------------------+-----
 -10 | Wed Jun 02 03:53:35.511728 2021 PDT | abc
   0 | Wed Jun 02 03:53:35.511728 2021 PDT | abc
  15 | Wed Jun 02 03:53:35.511728 2021 PDT | abc
  40 | Wed Jun 02 03:53:35.511728 2021 PDT | abc
(4 rows)

insert into t5 values(-20),(10), (25),(400);
select*from t5 where a between 30 and 100;
 a  |              b               |  c  
----+------------------------------+-----
 40 | Wed Jun 02 03:53:36 2021 PDT | abc
(1 row)

PREPARE q1(int, int) AS SELECT * FROM t5 WHERE a between $1 and $2;
EXECUTE q1(-100, 20);
  a  |              b               |  c  
-----+------------------------------+-----
 -20 | Wed Jun 02 03:53:36 2021 PDT | abc
 -10 | Wed Jun 02 03:53:36 2021 PDT | abc
   0 | Wed Jun 02 03:53:36 2021 PDT | abc
  10 | Wed Jun 02 03:53:36 2021 PDT | abc
  15 | Wed Jun 02 03:53:36 2021 PDT | abc
(5 rows)

EXECUTE q1(0, 40);
 a  |              b               |  c  
----+------------------------------+-----
  0 | Wed Jun 02 03:53:36 2021 PDT | abc
 10 | Wed Jun 02 03:53:36 2021 PDT | abc
 15 | Wed Jun 02 03:53:36 2021 PDT | abc
 25 | Wed Jun 02 03:53:36 2021 PDT | abc
 40 | Wed Jun 02 03:53:36 2021 PDT | abc
(5 rows)

PREPARE q2(int, int) AS SELECT * FROM t1 WHERE a between $1 and $2;
EXECUTE q2(0, 10);
 a | b 
---+---
 1 | 1
 3 | 3
 8 | 8
 9 | 9
 2 | 2
 4 | 4
 6 | 6
 7 | 7
(8 rows)

EXECUTE q1(10, 30);
 a  |              b               |  c  
----+------------------------------+-----
 10 | Wed Jun 02 03:53:36 2021 PDT | abc
 15 | Wed Jun 02 03:53:36 2021 PDT | abc
 25 | Wed Jun 02 03:53:36 2021 PDT | abc
(3 rows)

EXECUTE q2(5, 40);
 a  | b  
----+----
 12 | 12
 14 | 14
 16 | 16
 17 | 17
  8 |  8
  9 |  9
 11 | 11
 19 | 19
 13 | 13
 18 | 18
  6 |  6
  7 |  7
(12 rows)

deallocate q1;
create table t4(a int primary key, b serial);
insert into t4 values(1),(2),(3),(4),(5),(6),(7),(8),(9),(10),(11),(12),(13),(14),(15),(16),(17),(18),(19),(20);
PREPARE q3(int, int) AS SELECT * FROM t4 WHERE a between $1 and $2;
EXECUTE q3(6, 16);
 a  | b  
----+----
  6 |  6
  7 |  7
  8 |  8
  9 |  9
 10 | 10
 11 | 11
 12 | 12
 13 | 13
 14 | 14
 15 | 15
 16 | 16
(11 rows)

EXECUTE q1(0, 30);
ERROR:  prepared statement "q1" does not exist
EXECUTE q2(5, 10);
 a | b 
---+---
 8 | 8
 9 | 9
 6 | 6
 7 | 7
(4 rows)

deallocate q2;
EXECUTE q3(0, 40);
 a  | b  
----+----
  1 |  1
  2 |  2
  3 |  3
  4 |  4
  5 |  5
  6 |  6
  7 |  7
  8 |  8
  9 |  9
 10 | 10
 11 | 11
 12 | 12
 13 | 13
 14 | 14
 15 | 15
 16 | 16
 17 | 17
 18 | 18
 19 | 19
 20 | 20
(20 rows)

PREPARE q4(int, int) as update t1 set b=$1 where a=$2;
select*from t1;
 a  | b  
----+----
  1 |  1
 12 | 12
 14 | 14
 16 | 16
 17 | 17
  3 |  3
  8 |  8
  9 |  9
 11 | 11
 19 | 19
  2 |  2
 13 | 13
 18 | 18
  4 |  4
  6 |  6
  7 |  7
(16 rows)

EXECUTE q4(10, 9);
EXECUTE q3(0, 40);
 a  | b  
----+----
  1 |  1
  2 |  2
  3 |  3
  4 |  4
  5 |  5
  6 |  6
  7 |  7
  8 |  8
  9 |  9
 10 | 10
 11 | 11
 12 | 12
 13 | 13
 14 | 14
 15 | 15
 16 | 16
 17 | 17
 18 | 18
 19 | 19
 20 | 20
(20 rows)

EXECUTE q4(11, 10);
prepare q6(int) as insert into t5 values($1);
EXECUTE q6(1);
EXECUTE q6(2);
begin;
EXECUTE q6(12);
EXECUTE q4(14, 13);
EXECUTE q6(13);
commit;
EXECUTE q6(21);
EXECUTE q6(22);
EXECUTE q6(23);
begin;
EXECUTE q6(31);
EXECUTE q6(33);
select*from t5;
  a  |              b               |  c  
-----+------------------------------+-----
 -20 | Wed Jun 02 03:53:36 2021 PDT | abc
 -10 | Wed Jun 02 03:53:36 2021 PDT | abc
   0 | Wed Jun 02 03:53:36 2021 PDT | abc
   1 | Wed Jun 02 03:53:39 2021 PDT | abc
   2 | Wed Jun 02 03:53:39 2021 PDT | abc
  10 | Wed Jun 02 03:53:36 2021 PDT | abc
  12 | Wed Jun 02 03:53:39 2021 PDT | abc
  13 | Wed Jun 02 03:53:39 2021 PDT | abc
  15 | Wed Jun 02 03:53:36 2021 PDT | abc
  21 | Wed Jun 02 03:53:39 2021 PDT | abc
  22 | Wed Jun 02 03:53:39 2021 PDT | abc
  23 | Wed Jun 02 03:53:39 2021 PDT | abc
  25 | Wed Jun 02 03:53:36 2021 PDT | abc
  31 | Wed Jun 02 03:53:39 2021 PDT | abc
  33 | Wed Jun 02 03:53:39 2021 PDT | abc
  40 | Wed Jun 02 03:53:36 2021 PDT | abc
 400 | Wed Jun 02 03:53:36 2021 PDT | abc
(17 rows)

commit;
prepare q5(varchar(32), int, varchar(32)) as update  t5 set c=$1 where a%7=$2 and c=$3;
begin;
EXECUTE q5('def', 3, 'abc');
EXECUTE q6(3);
EXECUTE q6(4);
commit;
EXECUTE q6(11);
EXECUTE q6(32);
EXECUTE q3(0, 40);
 a  | b  
----+----
  1 |  1
  2 |  2
  3 |  3
  4 |  4
  5 |  5
  6 |  6
  7 |  7
  8 |  8
  9 |  9
 10 | 10
 11 | 11
 12 | 12
 13 | 13
 14 | 14
 15 | 15
 16 | 16
 17 | 17
 18 | 18
 19 | 19
 20 | 20
(20 rows)

deallocate q3;
EXECUTE q3(10, 40);
ERROR:  prepared statement "q3" does not exist
begin;
EXECUTE q4(12, 11);
select*from t1 where a between 9 and 12;
 a  | b  
----+----
 12 | 12
  9 | 10
 11 | 12
(3 rows)

select*from t5 ;
  a  |              b               |  c  
-----+------------------------------+-----
 -20 | Wed Jun 02 03:53:36 2021 PDT | abc
 -10 | Wed Jun 02 03:53:36 2021 PDT | abc
   0 | Wed Jun 02 03:53:36 2021 PDT | abc
   1 | Wed Jun 02 03:53:39 2021 PDT | abc
   2 | Wed Jun 02 03:53:39 2021 PDT | abc
   3 | Wed Jun 02 03:53:39 2021 PDT | abc
   4 | Wed Jun 02 03:53:39 2021 PDT | abc
  10 | Wed Jun 02 03:53:36 2021 PDT | def
  11 | Wed Jun 02 03:53:39 2021 PDT | abc
  12 | Wed Jun 02 03:53:39 2021 PDT | abc
  13 | Wed Jun 02 03:53:39 2021 PDT | abc
  15 | Wed Jun 02 03:53:36 2021 PDT | abc
  21 | Wed Jun 02 03:53:39 2021 PDT | abc
  22 | Wed Jun 02 03:53:39 2021 PDT | abc
  23 | Wed Jun 02 03:53:39 2021 PDT | abc
  25 | Wed Jun 02 03:53:36 2021 PDT | abc
  31 | Wed Jun 02 03:53:39 2021 PDT | def
  32 | Wed Jun 02 03:53:39 2021 PDT | abc
  33 | Wed Jun 02 03:53:39 2021 PDT | abc
  40 | Wed Jun 02 03:53:36 2021 PDT | abc
 400 | Wed Jun 02 03:53:36 2021 PDT | abc
(21 rows)

EXECUTE q5('xyz', 3, 'def');
EXECUTE q5('XYZ', 4, 'abc');
commit;
EXECUTE q5('MNO', 5, 'abc');
select*from t5 where a%7=3 or a%7=4 or a%7=5;
 a  |              b               |  c  
----+------------------------------+-----
  3 | Wed Jun 02 03:53:39 2021 PDT | abc
  4 | Wed Jun 02 03:53:39 2021 PDT | XYZ
 10 | Wed Jun 02 03:53:36 2021 PDT | xyz
 11 | Wed Jun 02 03:53:39 2021 PDT | XYZ
 12 | Wed Jun 02 03:53:39 2021 PDT | MNO
 25 | Wed Jun 02 03:53:36 2021 PDT | XYZ
 31 | Wed Jun 02 03:53:39 2021 PDT | xyz
 32 | Wed Jun 02 03:53:39 2021 PDT | XYZ
 33 | Wed Jun 02 03:53:39 2021 PDT | MNO
 40 | Wed Jun 02 03:53:36 2021 PDT | MNO
(10 rows)

EXECUTE q5('qps', 11, 'XYZ');
deallocate q4;
deallocate q5;
create table t31(a int primary key, b int, c int, d int);
insert into t31 values
(21 ,  1 , 21 ,  1),
( 22 ,  2 , 22 ,  2),
( 23 ,  3 , 23 ,  3),
( 24 , 14 , 24 ,  4),
( 25 , 15 , 25 ,  5);
select a,b,c, case a%2 when 0 then b when 1 then c end as x from t31 where (case when b > 10 then b%3=2 when b <10 then b%2=1 end);
 a  | b  | c  | x  
----+----+----+----
 21 |  1 | 21 | 21
 23 |  3 | 23 | 23
 24 | 14 | 24 | 14
(3 rows)

select count(*) from t2 where b <= current_timestamp;
 count 
-------
     3
(1 row)

select * from t31 where a=any(select b+23 from t31);
 a  | b  | c  | d 
----+----+----+---
 24 | 14 | 24 | 4
 25 | 15 | 25 | 5
(2 rows)

select * from t31 where a=all(select b+23 from t31);
 a | b | c | d 
---+---+---+---
(0 rows)

select * from t31 where a!=all(values(1),(21),(23));
 a  | b  | c  | d 
----+----+----+---
 22 |  2 | 22 | 2
 24 | 14 | 24 | 4
 25 | 15 | 25 | 5
(3 rows)

select * from t31 where a=any(values(1),(21),(22));
 a  | b | c  | d 
----+---+----+---
 21 | 1 | 21 | 1
 22 | 2 | 22 | 2
(2 rows)

select greatest(a,b,c) as g, least(a,b,c) as l from t31;
 g  | l  
----+----
 21 |  1
 22 |  2
 23 |  3
 24 | 14
 25 | 15
(5 rows)

select greatest(a,b,c) as g, least(a,b,c) as l, coalesce(null,a,b,c) from t31;
 g  | l  | coalesce 
----+----+----------
 21 |  1 |       21
 22 |  2 |       22
 23 |  3 |       23
 24 | 14 |       24
 25 | 15 |       25
(5 rows)

drop table t31;
drop table t2;
drop table t1;
drop table t4;
drop table t5;
