--create--
drop DATABASE if exists 星际穿越;
psql:sql/charset_zh_CN.sql:2: NOTICE:  database "星际穿越" does not exist, skipping
DROP DATABASE
CREATE DATABASE 星际穿越;
CREATE DATABASE
\c 星际穿越
You are now connected to database "星际穿越" as user "abc".
CREATE USER 月亮 with PASSWORD '月亮';
CREATE ROLE
GRANT ALL on database  星际穿越 TO 月亮;
GRANT
ALTER USER 月亮 RENAME TO 太阳;
psql:sql/charset_zh_CN.sql:7: NOTICE:  MD5 password cleared because of role rename
ALTER ROLE
--select * from pg_user;
revoke  ALL on database  星际穿越 from 太阳;
REVOKE
drop user 太阳;
DROP ROLE
--select * from pg_user;

CREATE SCHEMA 地球;
CREATE SCHEMA
--SELECT * FROM pg_namespace;
create table 地球.中国(编号 int primary key ,城市 text not NULL,省会 text not null);
CREATE TABLE
select * from 地球.中国;
 编号 | 城市 | 省会 
------+------+------
(0 rows)

\d
psql:sql/charset_zh_CN.sql:17: error: Did not find any relations.
drop schema 地球  CASCADE;
psql:sql/charset_zh_CN.sql:18: NOTICE:  drop cascades to table "地球"."中国"
DROP SCHEMA
--SELECT * FROM pg_namespace;

--CREATE TABLE--
create table 个人表(编号 integer primary key, 姓名 varchar(10),年龄 serial,身高 text);
CREATE TABLE

--alter table--
alter table 个人表  rename to 信息表;
ALTER TABLE
alter table 信息表  alter column 年龄 drop default;
ALTER TABLE
\d 信息表
                      Table "public.信息表"
 Column |         Type          | Collation | Nullable | Default 
--------+-----------------------+-----------+----------+---------
 编号   | integer               |           | not null | 
 姓名   | character varying(10) |           |          | 
 年龄   | integer               |           | not null | 
 身高   | text                  |           |          | 
Indexes:
    "个人表_pkey" PRIMARY KEY, btree ("编号")

alter table 信息表 add constraint 年龄 unique(年龄);
ALTER TABLE
\d 信息表
                      Table "public.信息表"
 Column |         Type          | Collation | Nullable | Default 
--------+-----------------------+-----------+----------+---------
 编号   | integer               |           | not null | 
 姓名   | character varying(10) |           |          | 
 年龄   | integer               |           | not null | 
 身高   | text                  |           |          | 
Indexes:
    "个人表_pkey" PRIMARY KEY, btree ("编号")
    "年龄" UNIQUE CONSTRAINT, btree ("年龄")

alter table 信息表 drop constraint "年龄";
ALTER TABLE
\d 信息表
                      Table "public.信息表"
 Column |         Type          | Collation | Nullable | Default 
--------+-----------------------+-----------+----------+---------
 编号   | integer               |           | not null | 
 姓名   | character varying(10) |           |          | 
 年龄   | integer               |           | not null | 
 身高   | text                  |           |          | 
Indexes:
    "个人表_pkey" PRIMARY KEY, btree ("编号")


alter table 信息表  add 性别 int NULL;
ALTER TABLE
select * from 信息表;
 编号 | 姓名 | 年龄 | 身高 | 性别 
------+------+------+------+------
(0 rows)

alter table 信息表  rename  性别 to 地址;
ALTER TABLE
select * from 信息表;
 编号 | 姓名 | 年龄 | 身高 | 地址 
------+------+------+------+------
(0 rows)

alter table 信息表  rename  年龄 to 性别;
ALTER TABLE
select * from 信息表;
 编号 | 姓名 | 性别 | 身高 | 地址 
------+------+------+------+------
(0 rows)

alter table 信息表  rename  身高 to 爱好;
ALTER TABLE
\d 信息表
                      Table "public.信息表"
 Column |         Type          | Collation | Nullable | Default 
--------+-----------------------+-----------+----------+---------
 编号   | integer               |           | not null | 
 姓名   | character varying(10) |           |          | 
 性别   | integer               |           | not null | 
 爱好   | text                  |           |          | 
 地址   | integer               |           |          | 
Indexes:
    "个人表_pkey" PRIMARY KEY, btree ("编号")

alter table 信息表 alter column 地址 type text USING 地址::text;
ALTER TABLE
alter table 信息表 alter column 性别 type char USING 性别::char;
ALTER TABLE
\d 信息表
                      Table "public.信息表"
 Column |         Type          | Collation | Nullable | Default 
--------+-----------------------+-----------+----------+---------
 编号   | integer               |           | not null | 
 姓名   | character varying(10) |           |          | 
 性别   | character(1)          |           | not null | 
 爱好   | text                  |           |          | 
 地址   | text                  |           |          | 
Indexes:
    "个人表_pkey" PRIMARY KEY, btree ("编号")


--alter table 信息表 add constraint 性别 check(2) (性别='男' or 性别='女') (性别);  #暂时不支持check

--INSERT into-- 
insert into 信息表(编号,姓名,性别,爱好,地址) values(1,'张三','男','乒乓球','上海');
INSERT 0 1
insert into 信息表(编号,姓名,性别,爱好,地址) values(2,'李四','男','乒乓球','广东');
INSERT 0 1
insert into 信息表(编号,姓名,性别,爱好,地址) values(3,'王五','男','篮球','四川');
INSERT 0 1
insert into 信息表(编号,姓名,性别,爱好,地址) values(4,'陈六','男','爬山','四川');
INSERT 0 1
insert into 信息表(编号,姓名,性别,爱好,地址) values(5,'陈琪','女','蹦极','重庆');
INSERT 0 1
insert into 信息表(编号,姓名,性别,爱好,地址) values(6,'李舞','女',DEFAULT,'重庆'),(7,'张霸','男','篮球',DEFAULT);
INSERT 0 2
select * from 信息表;
 编号 | 姓名 | 性别 |  爱好  | 地址 
------+------+------+--------+------
    1 | 张三 | 男   | 乒乓球 | 上海
    2 | 李四 | 男   | 乒乓球 | 广东
    3 | 王五 | 男   | 篮球   | 四川
    4 | 陈六 | 男   | 爬山   | 四川
    5 | 陈琪 | 女   | 蹦极   | 重庆
    6 | 李舞 | 女   |        | 重庆
    7 | 张霸 | 男   | 篮球   | 
(7 rows)


--noll--
SELECT * FROM 信息表 WHERE 地址 IS   NOT NULL;
 编号 | 姓名 | 性别 |  爱好  | 地址 
------+------+------+--------+------
    1 | 张三 | 男   | 乒乓球 | 上海
    2 | 李四 | 男   | 乒乓球 | 广东
    3 | 王五 | 男   | 篮球   | 四川
    4 | 陈六 | 男   | 爬山   | 四川
    5 | 陈琪 | 女   | 蹦极   | 重庆
    6 | 李舞 | 女   |        | 重庆
(6 rows)

SELECT * FROM 信息表 WHERE 地址 IS  NULL;
 编号 | 姓名 | 性别 | 爱好 | 地址 
------+------+------+------+------
    7 | 张霸 | 男   | 篮球 | 
(1 row)


--UPDATE --
update 信息表 set 爱好 ='爬山'  where 编号 = 6;
UPDATE 1
update 信息表 set 爱好 ='蹦极',地址='广东'  where 编号 = 7;
UPDATE 1
select * from 信息表;
 编号 | 姓名 | 性别 |  爱好  | 地址 
------+------+------+--------+------
    1 | 张三 | 男   | 乒乓球 | 上海
    2 | 李四 | 男   | 乒乓球 | 广东
    3 | 王五 | 男   | 篮球   | 四川
    4 | 陈六 | 男   | 爬山   | 四川
    5 | 陈琪 | 女   | 蹦极   | 重庆
    6 | 李舞 | 女   | 爬山   | 重庆
    7 | 张霸 | 男   | 蹦极   | 广东
(7 rows)


--select--
select 姓名,爱好 from 信息表;
 姓名 |  爱好  
------+--------
 张三 | 乒乓球
 李四 | 乒乓球
 王五 | 篮球
 陈六 | 爬山
 陈琪 | 蹦极
 李舞 | 爬山
 张霸 | 蹦极
(7 rows)

select * from 信息表 where 性别='男';
 编号 | 姓名 | 性别 |  爱好  | 地址 
------+------+------+--------+------
    1 | 张三 | 男   | 乒乓球 | 上海
    2 | 李四 | 男   | 乒乓球 | 广东
    3 | 王五 | 男   | 篮球   | 四川
    4 | 陈六 | 男   | 爬山   | 四川
    7 | 张霸 | 男   | 蹦极   | 广东
(5 rows)

select * from 信息表 where 编号>=4;
 编号 | 姓名 | 性别 | 爱好 | 地址 
------+------+------+------+------
    4 | 陈六 | 男   | 爬山 | 四川
    5 | 陈琪 | 女   | 蹦极 | 重庆
    6 | 李舞 | 女   | 爬山 | 重庆
    7 | 张霸 | 男   | 蹦极 | 广东
(4 rows)

select * from 信息表 where 地址!='四川';
 编号 | 姓名 | 性别 |  爱好  | 地址 
------+------+------+--------+------
    1 | 张三 | 男   | 乒乓球 | 上海
    2 | 李四 | 男   | 乒乓球 | 广东
    5 | 陈琪 | 女   | 蹦极   | 重庆
    6 | 李舞 | 女   | 爬山   | 重庆
    7 | 张霸 | 男   | 蹦极   | 广东
(5 rows)

select * from 信息表 where 编号>2 and 编号<5;
 编号 | 姓名 | 性别 | 爱好 | 地址 
------+------+------+------+------
    3 | 王五 | 男   | 篮球 | 四川
    4 | 陈六 | 男   | 爬山 | 四川
(2 rows)

select * from 信息表 where 编号>=2 and 编号<=5;
 编号 | 姓名 | 性别 |  爱好  | 地址 
------+------+------+--------+------
    2 | 李四 | 男   | 乒乓球 | 广东
    3 | 王五 | 男   | 篮球   | 四川
    4 | 陈六 | 男   | 爬山   | 四川
    5 | 陈琪 | 女   | 蹦极   | 重庆
(4 rows)

select * from 信息表 where 编号 in (2,6);
 编号 | 姓名 | 性别 |  爱好  | 地址 
------+------+------+--------+------
    2 | 李四 | 男   | 乒乓球 | 广东
    6 | 李舞 | 女   | 爬山   | 重庆
(2 rows)

select * from 信息表 where 编号 BETWEEN 2 and 5;
 编号 | 姓名 | 性别 |  爱好  | 地址 
------+------+------+--------+------
    2 | 李四 | 男   | 乒乓球 | 广东
    3 | 王五 | 男   | 篮球   | 四川
    4 | 陈六 | 男   | 爬山   | 四川
    5 | 陈琪 | 女   | 蹦极   | 重庆
(4 rows)

select * from 信息表 where 性别='男' and 爱好='乒乓球';
 编号 | 姓名 | 性别 |  爱好  | 地址 
------+------+------+--------+------
    1 | 张三 | 男   | 乒乓球 | 上海
    2 | 李四 | 男   | 乒乓球 | 广东
(2 rows)

select * from 信息表 where 性别='女' or 爱好='乒乓球';
 编号 | 姓名 | 性别 |  爱好  | 地址 
------+------+------+--------+------
    1 | 张三 | 男   | 乒乓球 | 上海
    2 | 李四 | 男   | 乒乓球 | 广东
    5 | 陈琪 | 女   | 蹦极   | 重庆
    6 | 李舞 | 女   | 爬山   | 重庆
(4 rows)


select * from 信息表 where 姓名 like '陈%';
 编号 | 姓名 | 性别 | 爱好 | 地址 
------+------+------+------+------
    4 | 陈六 | 男   | 爬山 | 四川
    5 | 陈琪 | 女   | 蹦极 | 重庆
(2 rows)

select * from 信息表 where 姓名 like '%五%';
 编号 | 姓名 | 性别 | 爱好 | 地址 
------+------+------+------+------
    3 | 王五 | 男   | 篮球 | 四川
(1 row)

select * from 信息表 limit 4;
 编号 | 姓名 | 性别 |  爱好  | 地址 
------+------+------+--------+------
    1 | 张三 | 男   | 乒乓球 | 上海
    2 | 李四 | 男   | 乒乓球 | 广东
    3 | 王五 | 男   | 篮球   | 四川
    4 | 陈六 | 男   | 爬山   | 四川
(4 rows)

select * from 信息表 limit 4 OFFSET 2;
 编号 | 姓名 | 性别 | 爱好 | 地址 
------+------+------+------+------
    3 | 王五 | 男   | 篮球 | 四川
    4 | 陈六 | 男   | 爬山 | 四川
    5 | 陈琪 | 女   | 蹦极 | 重庆
    6 | 李舞 | 女   | 爬山 | 重庆
(4 rows)

select * from 信息表 order by 编号 desc;
 编号 | 姓名 | 性别 |  爱好  | 地址 
------+------+------+--------+------
    7 | 张霸 | 男   | 蹦极   | 广东
    6 | 李舞 | 女   | 爬山   | 重庆
    5 | 陈琪 | 女   | 蹦极   | 重庆
    4 | 陈六 | 男   | 爬山   | 四川
    3 | 王五 | 男   | 篮球   | 四川
    2 | 李四 | 男   | 乒乓球 | 广东
    1 | 张三 | 男   | 乒乓球 | 上海
(7 rows)



create table 个人表(编号 integer primary key, 姓名 varchar(10),工资 integer,工作 text);
CREATE TABLE

insert into 个人表(编号,姓名,工资,工作) values(1,'张三',15000,'内科'),(2,'李四',18000,'内科'),(3,'王五',25000,'外科'),(4,'陈六',25000,'外科'),
(5,'陈琪',10000,'前台'),(6,'李舞',15000,'外科'),(7,'张霸',20000 ,'内科');
INSERT 0 7

SELECT 姓名,SUM(工资) FROM 个人表 GROUP BY 姓名 ORDER BY 姓名;
 姓名 |  sum  
------+-------
 张三 | 15000
 张霸 | 20000
 李四 | 18000
 李舞 | 15000
 王五 | 25000
 陈六 | 25000
 陈琪 | 10000
(7 rows)

SELECT 工作,avg(工资) FROM 个人表 GROUP BY 工作 order by AVG(工资);
 工作 |          avg           
------+------------------------
 前台 | 10000.0000000000000000
 内科 |     17666.666666666667
 外科 |     21666.666666666667
(3 rows)

select 工作,max(工资) from 个人表 group by 工作 order by max(工资)desc; 
 工作 |  max  
------+-------
 外科 | 25000
 内科 | 20000
 前台 | 10000
(3 rows)

select 工作,min(工资) from 个人表 group by 工作order by min(工资)desc;
psql:sql/charset_zh_CN.sql:92: ERROR:  syntax error at or near "by"
LINE 1: ...lect 工作,min(工资) from 个人表 group by 工作order by min(工...
                                                              ^
select 工作,count(工资) from 个人表 group by 工作order by 工作 desc;
psql:sql/charset_zh_CN.sql:93: ERROR:  syntax error at or near "by"
LINE 1: ...t 工作,count(工资) from 个人表 group by 工作order by 工作 de...
                                                             ^
select 工资,count(工作) from 个人表 group by 工资 order by 工资 desc;
 工资  | count 
-------+-------
 25000 |     2
 20000 |     1
 18000 |     1
 15000 |     2
 10000 |     1
(5 rows)

select 工资 from 个人表 group by 工资 having count(工资) > 1 order by 工资;
 工资  
-------
 15000
 25000
(2 rows)

select 工作,count(工作) from 个人表 group by 工作 having count(工作) > 2  order by 工作desc;
psql:sql/charset_zh_CN.sql:96: ERROR:  column "工作desc" does not exist
LINE 1: ...表 group by 工作 having count(工作) > 2  order by 工作desc;
                                                             ^
select 工作 from 个人表 where 工作 = '前台';
 工作 
------
 前台
(1 row)

select 工作,count(工作) from 个人表 where 工作='前台' group by 工作;
 工作 | count 
------+-------
 前台 |     1
(1 row)

select * from  个人表 where 编号 in (select 编号 from 个人表 where 工资 > 20000 );
 编号 | 姓名 | 工资  | 工作 
------+------+-------+------
    3 | 王五 | 25000 | 外科
    4 | 陈六 | 25000 | 外科
(2 rows)



insert into 个人表(编号,姓名,工资,工作) values(8,'王发',45000,DEFAULT);
INSERT 0 1

select * from 个人表;
 编号 | 姓名 | 工资  | 工作 
------+------+-------+------
    1 | 张三 | 15000 | 内科
    2 | 李四 | 18000 | 内科
    3 | 王五 | 25000 | 外科
    4 | 陈六 | 25000 | 外科
    5 | 陈琪 | 10000 | 前台
    6 | 李舞 | 15000 | 外科
    7 | 张霸 | 20000 | 内科
    8 | 王发 | 45000 | 
(8 rows)


insert into 信息表(编号,姓名,性别,爱好,地址) values(9,'李珐','女','乒乓球','上海');
INSERT 0 1



select  一.编号,一.姓名,二.性别,一.工资,一.工作,二.地址,二.爱好  
from 个人表 as 一 inner  join 信息表 as 二 
on 一.编号=二.编号;
 编号 | 姓名 | 性别 | 工资  | 工作 | 地址 |  爱好  
------+------+------+-------+------+------+--------
    1 | 张三 | 男   | 15000 | 内科 | 上海 | 乒乓球
    2 | 李四 | 男   | 18000 | 内科 | 广东 | 乒乓球
    3 | 王五 | 男   | 25000 | 外科 | 四川 | 篮球
    4 | 陈六 | 男   | 25000 | 外科 | 四川 | 爬山
    5 | 陈琪 | 女   | 10000 | 前台 | 重庆 | 蹦极
    6 | 李舞 | 女   | 15000 | 外科 | 重庆 | 爬山
    7 | 张霸 | 男   | 20000 | 内科 | 广东 | 蹦极
(7 rows)


select  一.编号,一.姓名,二.性别,一.工资,一.工作,二.地址,二.爱好  
from 个人表 as 一 right outer join 信息表 as 二 
on 一.编号=二.编号;
 编号 | 姓名 | 性别 | 工资  | 工作 | 地址 |  爱好  
------+------+------+-------+------+------+--------
    1 | 张三 | 男   | 15000 | 内科 | 上海 | 乒乓球
    2 | 李四 | 男   | 18000 | 内科 | 广东 | 乒乓球
    3 | 王五 | 男   | 25000 | 外科 | 四川 | 篮球
    4 | 陈六 | 男   | 25000 | 外科 | 四川 | 爬山
    5 | 陈琪 | 女   | 10000 | 前台 | 重庆 | 蹦极
    6 | 李舞 | 女   | 15000 | 外科 | 重庆 | 爬山
    7 | 张霸 | 男   | 20000 | 内科 | 广东 | 蹦极
      |      | 女   |       |      | 上海 | 乒乓球
(8 rows)


select  一.编号,一.姓名,二.性别,一.工资,一.工作,二.地址,二.爱好  
from 个人表 as 一 left outer join 信息表 as 二 
on 一.编号=二.编号;
 编号 | 姓名 | 性别 | 工资  | 工作 | 地址 |  爱好  
------+------+------+-------+------+------+--------
    1 | 张三 | 男   | 15000 | 内科 | 上海 | 乒乓球
    2 | 李四 | 男   | 18000 | 内科 | 广东 | 乒乓球
    3 | 王五 | 男   | 25000 | 外科 | 四川 | 篮球
    4 | 陈六 | 男   | 25000 | 外科 | 四川 | 爬山
    5 | 陈琪 | 女   | 10000 | 前台 | 重庆 | 蹦极
    6 | 李舞 | 女   | 15000 | 外科 | 重庆 | 爬山
    7 | 张霸 | 男   | 20000 | 内科 | 广东 | 蹦极
    8 | 王发 |      | 45000 |      |      | 
(8 rows)



--CREATE INDEX--
create index 姓名索引 on 个人表 (姓名);
CREATE INDEX
\d 个人表
                      Table "public.个人表"
 Column |         Type          | Collation | Nullable | Default 
--------+-----------------------+-----------+----------+---------
 编号   | integer               |           | not null | 
 姓名   | character varying(10) |           |          | 
 工资   | integer               |           |          | 
 工作   | text                  |           |          | 
Indexes:
    "个人表_pkey1" PRIMARY KEY, btree ("编号")
    "姓名索引" btree ("姓名")

ALTER INDEX 姓名索引 RENAME TO 索引名字;
ALTER INDEX
\d 个人表
                      Table "public.个人表"
 Column |         Type          | Collation | Nullable | Default 
--------+-----------------------+-----------+----------+---------
 编号   | integer               |           | not null | 
 姓名   | character varying(10) |           |          | 
 工资   | integer               |           |          | 
 工作   | text                  |           |          | 
Indexes:
    "个人表_pkey1" PRIMARY KEY, btree ("编号")
    "索引名字" btree ("姓名")

create index 组合索引 on 个人表 (工资,工作);
CREATE INDEX
\d 个人表
                      Table "public.个人表"
 Column |         Type          | Collation | Nullable | Default 
--------+-----------------------+-----------+----------+---------
 编号   | integer               |           | not null | 
 姓名   | character varying(10) |           |          | 
 工资   | integer               |           |          | 
 工作   | text                  |           |          | 
Indexes:
    "个人表_pkey1" PRIMARY KEY, btree ("编号")
    "索引名字" btree ("姓名")
    "组合索引" btree ("工资", "工作")

drop index 索引名字;
DROP INDEX
drop index 组合索引;
DROP INDEX
\d 个人表
                      Table "public.个人表"
 Column |         Type          | Collation | Nullable | Default 
--------+-----------------------+-----------+----------+---------
 编号   | integer               |           | not null | 
 姓名   | character varying(10) |           |          | 
 工资   | integer               |           |          | 
 工作   | text                  |           |          | 
Indexes:
    "个人表_pkey1" PRIMARY KEY, btree ("编号")


--view--
CREATE VIEW 个人表_视图 AS select 编号,姓名,工作 from 个人表;
CREATE VIEW
select * from 个人表_视图;
 编号 | 姓名 | 工作 
------+------+------
    1 | 张三 | 内科
    2 | 李四 | 内科
    3 | 王五 | 外科
    4 | 陈六 | 外科
    5 | 陈琪 | 前台
    6 | 李舞 | 外科
    7 | 张霸 | 内科
    8 | 王发 | 
(8 rows)

drop view 个人表_视图;
DROP VIEW
\d 
              List of relations
 Schema |      Name       |   Type   | Owner 
--------+-----------------+----------+-------
 public | 个人表          | table    | abc
 public | 个人表_年龄_seq | sequence | abc
 public | 信息表          | table    | abc
(3 rows)

--create table as--暂时不支持
--create table 个人表二 as select * from 个人表
--\d 个人表二
--select * from 个人表二;

--删除--

select * from 个人表;
 编号 | 姓名 | 工资  | 工作 
------+------+-------+------
    1 | 张三 | 15000 | 内科
    2 | 李四 | 18000 | 内科
    3 | 王五 | 25000 | 外科
    4 | 陈六 | 25000 | 外科
    5 | 陈琪 | 10000 | 前台
    6 | 李舞 | 15000 | 外科
    7 | 张霸 | 20000 | 内科
    8 | 王发 | 45000 | 
(8 rows)

delete from 个人表 where 编号=2;
DELETE 1
select * from 个人表;
 编号 | 姓名 | 工资  | 工作 
------+------+-------+------
    1 | 张三 | 15000 | 内科
    3 | 王五 | 25000 | 外科
    4 | 陈六 | 25000 | 外科
    5 | 陈琪 | 10000 | 前台
    6 | 李舞 | 15000 | 外科
    7 | 张霸 | 20000 | 内科
    8 | 王发 | 45000 | 
(7 rows)

delete from 个人表 where 工作='前台' or 工资 > 20000;
DELETE 4
select * from 个人表;
 编号 | 姓名 | 工资  | 工作 
------+------+-------+------
    1 | 张三 | 15000 | 内科
    6 | 李舞 | 15000 | 外科
    7 | 张霸 | 20000 | 内科
(3 rows)

delete from 个人表 where 编号 <=5;
DELETE 1
select * from 个人表;
 编号 | 姓名 | 工资  | 工作 
------+------+-------+------
    6 | 李舞 | 15000 | 外科
    7 | 张霸 | 20000 | 内科
(2 rows)

delete from 信息表 where  爱好 = '篮球' and 地址='四川';
DELETE 1
select * from 信息表;
 编号 | 姓名 | 性别 |  爱好  | 地址 
------+------+------+--------+------
    1 | 张三 | 男   | 乒乓球 | 上海
    2 | 李四 | 男   | 乒乓球 | 广东
    4 | 陈六 | 男   | 爬山   | 四川
    5 | 陈琪 | 女   | 蹦极   | 重庆
    6 | 李舞 | 女   | 爬山   | 重庆
    7 | 张霸 | 男   | 蹦极   | 广东
    9 | 李珐 | 女   | 乒乓球 | 上海
(7 rows)

delete from 信息表 where  性别 = '男' or 爱好='爬山';
DELETE 5
select * from 信息表;
 编号 | 姓名 | 性别 |  爱好  | 地址 
------+------+------+--------+------
    5 | 陈琪 | 女   | 蹦极   | 重庆
    9 | 李珐 | 女   | 乒乓球 | 上海
(2 rows)


--truncate table 信息表; 暂时不支持
--\d 信息表
delete from 个人表;
DELETE 2
\d 个人表
                      Table "public.个人表"
 Column |         Type          | Collation | Nullable | Default 
--------+-----------------------+-----------+----------+---------
 编号   | integer               |           | not null | 
 姓名   | character varying(10) |           |          | 
 工资   | integer               |           |          | 
 工作   | text                  |           |          | 
Indexes:
    "个人表_pkey1" PRIMARY KEY, btree ("编号")

delete from 信息表;
DELETE 2
\d 信息表
                      Table "public.信息表"
 Column |         Type          | Collation | Nullable | Default 
--------+-----------------------+-----------+----------+---------
 编号   | integer               |           | not null | 
 姓名   | character varying(10) |           |          | 
 性别   | character(1)          |           | not null | 
 爱好   | text                  |           |          | 
 地址   | text                  |           |          | 
Indexes:
    "个人表_pkey" PRIMARY KEY, btree ("编号")




drop table 信息表;
DROP TABLE
drop table 个人表;
DROP TABLE
\c postgres
You are now connected to database "postgres" as user "abc".
drop database 星际穿越;
DROP DATABASE
