--Unsupported types
--Domain Types 域类型
--Range Types  范围类型
--Composite Types 组合类型
--Arrays  数组
--Geometric Types 几何类型
--XML Type--XML类型 需要编译时,插入--with-libxml参数
--DETAIL:  This functionality requires the server to be built with libxml support.
--HINT:  You need to rebuild PostgreSQL using --with-libxml.
-- ./configure --with-libxml  gmake && gmake install 
--Numeric Types--
drop table if exists t1;
DROP TABLE
create table t1 (
id serial,
a integer, 
b smallint, 
c bigint);
CREATE TABLE
--Testing of boundary values 
insert into t1 values(DEFAULT,88,99,100);
INSERT 0 1
insert into t1 (a,b,c) values (2147483647,32767,9223372036854775807);
INSERT 0 1
insert into t1 (a,b,c) values(-2147483648,-32768,-9223372036854775808);
INSERT 0 1
select * from t1;
 id |      a      |   b    |          c           
----+-------------+--------+----------------------
  1 |          88 |     99 |                  100
  2 |  2147483647 |  32767 |  9223372036854775807
  3 | -2147483648 | -32768 | -9223372036854775808
(3 rows)

--integer
insert into t1 VALUES(DEFAULT,DEFAULT,DEFAULT,DEFAULT);
INSERT 0 1
UPDATE t1 set a='456' where id=4;
UPDATE 1
UPDATE t1 set b='123' where id=4;
UPDATE 1
UPDATE t1 set c='789' where id=4;
UPDATE 1
select * from t1;
 id |      a      |   b    |          c           
----+-------------+--------+----------------------
  1 |          88 |     99 |                  100
  2 |  2147483647 |  32767 |  9223372036854775807
  3 | -2147483648 | -32768 | -9223372036854775808
  4 |         456 |    123 |                  789
(4 rows)

delete  from  t1 where a=456;
DELETE 1
--smallint
insert into t1 VALUES(DEFAULT,DEFAULT,DEFAULT,DEFAULT);
INSERT 0 1
UPDATE t1 set a='234' where id=5;
UPDATE 1
UPDATE t1 set b='678' where id=5;
UPDATE 1
UPDATE t1 set c='222' where id=5;
UPDATE 1
select * from t1;
 id |      a      |   b    |          c           
----+-------------+--------+----------------------
  1 |          88 |     99 |                  100
  2 |  2147483647 |  32767 |  9223372036854775807
  3 | -2147483648 | -32768 | -9223372036854775808
  5 |         234 |    678 |                  222
(4 rows)

delete  from  t1 where b=678;
DELETE 1
--bigint
insert into t1 VALUES(DEFAULT,DEFAULT,DEFAULT,DEFAULT);
INSERT 0 1
UPDATE t1 set a='12' where id=6;
UPDATE 1
UPDATE t1 set b='34' where id=6;
UPDATE 1
UPDATE t1 set c='56' where id=6;
UPDATE 1
select * from t1;
 id |      a      |   b    |          c           
----+-------------+--------+----------------------
  1 |          88 |     99 |                  100
  2 |  2147483647 |  32767 |  9223372036854775807
  3 | -2147483648 | -32768 | -9223372036854775808
  6 |          12 |     34 |                   56
(4 rows)

delete  from  t1 where c=56;
DELETE 1
--serial
UPDATE t1 set id='99' where c=100;
UPDATE 1
select * from t1 order by id ;	
 id |      a      |   b    |          c           
----+-------------+--------+----------------------
  2 |  2147483647 |  32767 |  9223372036854775807
  3 | -2147483648 | -32768 | -9223372036854775808
 99 |          88 |     99 |                  100
(3 rows)

delete  from  t1 where id=99;
DELETE 1
drop table t1;
DROP TABLE
--Arbitrary Precision Numbers 任意精度数字
drop table if exists t2;
psql:sql/datatypes_simple.sql:56: NOTICE:  table "t2" does not exist, skipping
DROP TABLE
create table t2 (
id smallserial,
a decimal,
b decimal(4,2),
c numeric(2)
);
CREATE TABLE
insert into t2 values (DEFAULT,DEFAULT,88.88,77);
INSERT 0 1
insert into t2 values (DEFAULT,DEFAULT,88.888,77.7);
INSERT 0 1
--smallserial
insert into t2 VALUES(32767,DEFAULT,22.22,22);
INSERT 0 1
UPDATE t2 set id='6' where c=22;
UPDATE 1
select * from t2 order by id ;	
 id | a |   b   | c  
----+---+-------+----
  1 |   | 88.88 | 77
  2 |   | 88.89 | 78
  6 |   | 22.22 | 22
(3 rows)

delete  from  t2 where id=6;
DELETE 1
--decimal()
select * from t2;
 id | a |   b   | c  
----+---+-------+----
  1 |   | 88.88 | 77
  2 |   | 88.89 | 78
(2 rows)

UPDATE t2 set b='55.55' where id=1;
UPDATE 1
select * from t2 ORDER by id;
 id | a |   b   | c  
----+---+-------+----
  1 |   | 55.55 | 77
  2 |   | 88.89 | 78
(2 rows)

delete  from  t2 where id=1;
DELETE 1
UPDATE t2 set c='33' where id=2;
UPDATE 1
select * from t2 order by id;
 id | a |   b   | c  
----+---+-------+----
  2 |   | 88.89 | 33
(1 row)

delete  from  t2 where c=33;
DELETE 1
drop table t2;
DROP TABLE
--Floating-Point Types and Serial Types -- 浮点和序数
drop table if exists t3;
psql:sql/datatypes_simple.sql:82: NOTICE:  table "t3" does not exist, skipping
DROP TABLE
create table t3(
id bigserial,
a real,  
b double precision); 
CREATE TABLE
insert into t3 values(default,333.333,44.12233);
INSERT 0 1
insert into t3(a,b) values(44556,123456);
INSERT 0 1
insert into t3(a,b) values(1.2345678901234e+20,1.2345678901234e+200);
INSERT 0 1
insert into t3(a,b) values(1.2345678901234e-20,1.2345678901234e-200);
INSERT 0 1
select * from t3;
 id |      a      |          b           
----+-------------+----------------------
  1 |     333.333 |             44.12233
  2 |       44556 |               123456
  3 | 1.23457e+20 | 1.2345678901234e+200
  4 | 1.23457e-20 | 1.2345678901234e-200
(4 rows)

--bigserial
insert into t3 VALUES(9223372036854775807,123,456);
INSERT 0 1
select * from t3;
         id          |      a      |          b           
---------------------+-------------+----------------------
                   1 |     333.333 |             44.12233
                   2 |       44556 |               123456
                   3 | 1.23457e+20 | 1.2345678901234e+200
                   4 | 1.23457e-20 | 1.2345678901234e-200
 9223372036854775807 |         123 |                  456
(5 rows)

UPDATE t3 set id='4' where b=456;
UPDATE 1
select * from t3 order by id ;	
 id |      a      |          b           
----+-------------+----------------------
  1 |     333.333 |             44.12233
  2 |       44556 |               123456
  3 | 1.23457e+20 | 1.2345678901234e+200
  4 | 1.23457e-20 | 1.2345678901234e-200
  4 |         123 |                  456
(5 rows)

delete  from  t3 where id=4;
DELETE 2
--real
UPDATE t3 set a='333' where id=1;
UPDATE 1
select * from t3 order by id ;
 id |      a      |          b           
----+-------------+----------------------
  1 |         333 |             44.12233
  2 |       44556 |               123456
  3 | 1.23457e+20 | 1.2345678901234e+200
(3 rows)

delete  from  t3 where a=333;
DELETE 1
select * from t3 order by id ;
 id |      a      |          b           
----+-------------+----------------------
  2 |       44556 |               123456
  3 | 1.23457e+20 | 1.2345678901234e+200
(2 rows)

--double precision
UPDATE t3 set b='666' where id=2;
UPDATE 1
select * from t3 order by id ;
 id |      a      |          b           
----+-------------+----------------------
  2 |       44556 |                  666
  3 | 1.23457e+20 | 1.2345678901234e+200
(2 rows)

delete  from  t3 where b=666;
DELETE 1
drop table t3;
DROP TABLE
--Monetary Types--
drop table if exists t4;
psql:sql/datatypes_simple.sql:113: NOTICE:  table "t4" does not exist, skipping
DROP TABLE
create table t4(
id int2,
a money);
CREATE TABLE
insert into t4 values (1,1);
INSERT 0 1
insert into t4 values (2,3.141);
INSERT 0 1
insert into t4 values (3,3.145);
INSERT 0 1
set lc_monetary='zh_CN.UTF-8';
SET
select * from t4;
 id |   a    
----+--------
  1 | ￥1.00
  2 | ￥3.14
  3 | ￥3.15
(3 rows)

UPDATE t4 set a='666' where id=1;
UPDATE 1
select * from t4 order by id;
 id |    a     
----+----------
  1 | ￥666.00
  2 |   ￥3.14
  3 |   ￥3.15
(3 rows)

delete  from  t4 where id=1;
DELETE 1
select sum(a) from t4;
  sum   
--------
 ￥6.29
(1 row)

drop table t4;
DROP TABLE
--Character Types 字符类型
drop table if exists char_test;
psql:sql/datatypes_simple.sql:130: NOTICE:  table "char_test" does not exist, skipping
DROP TABLE
create table char_test(
id int2,
a char(4),
b varchar(4));
CREATE TABLE
insert into char_test values(1,'abcd', 'qwer');
INSERT 0 1
insert into char_test values(2,'a', 'b');
INSERT 0 1
insert into char_test values(3,'1234', '5678');
INSERT 0 1
insert into char_test values(4,1234,5678);
INSERT 0 1
select * from char_test;
 id |  a   |  b   
----+------+------
  1 | abcd | qwer
  2 | a    | b
  3 | 1234 | 5678
  4 | 1234 | 5678
(4 rows)

--char(4)
UPDATE char_test set a='666' where id=3;
UPDATE 1
select * from char_test ORDER by id;
 id |  a   |  b   
----+------+------
  1 | abcd | qwer
  2 | a    | b
  3 | 666  | 5678
  4 | 1234 | 5678
(4 rows)

delete  from  char_test  where id=3;
DELETE 1
--varchar(4)
UPDATE char_test set b='3333' where id=4;
UPDATE 1
delete  from  char_test  where id=4;
DELETE 1
select  * from char_test ORDER by id;
 id |  a   |  b   
----+------+------
  1 | abcd | qwer
  2 | a    | b
(2 rows)

SELECT a, char_length(a),b,char_length(b) FROM char_test;
  a   | char_length |  b   | char_length 
------+-------------+------+-------------
 abcd |           4 | qwer |           4
 a    |           1 | b    |           1
(2 rows)

drop table char_test;
DROP TABLE
--Binary Data Types 
drop table if exists tab_bytea;
psql:sql/datatypes_simple.sql:156: NOTICE:  table "tab_bytea" does not exist, skipping
DROP TABLE
CREATE TABLE tab_bytea(a bytea,b bytea);
CREATE TABLE
INSERT INTO tab_bytea VALUES('\047',E'\xF');
INSERT 0 1
UPDATE tab_bytea set a='\134' where a='\047';
UPDATE 1
delete  from  tab_bytea  where a='\134';
DELETE 1
--SELECT * FROM tab_bytea;
drop table tab_bytea;
DROP TABLE
--Date/Time Types 日期/时间类型
drop table if exists tab_date;
psql:sql/datatypes_simple.sql:169: NOTICE:  table "tab_date" does not exist, skipping
DROP TABLE
CREATE TABLE tab_date(id smallserial,a date);
CREATE TABLE
show datestyle;
 DateStyle 
-----------
 ISO, YMD
(1 row)

INSERT INTO tab_date VALUES(DEFAULT,'2020-10-26');
INSERT 0 1
UPDATE tab_date set a='2021-10-26' where id=1;
UPDATE 1
SET datestyle = 'MDY';
SET
INSERT INTO tab_date VALUES(DEFAULT,'10-26-2020');
INSERT 0 1
--在MDY风格下，也支持YMD的输入方式，但是不支持DMY或者其它格式的输入，如下会报错
INSERT INTO tab_date VALUES(DEFAULT, '2021-10-28');
INSERT 0 1
SET datestyle = 'DMY';
SET
INSERT INTO tab_date VALUES(DEFAULT, '26-10-2021');
INSERT 0 1
UPDATE tab_date set a='2021-10-27' where id=4;
UPDATE 1
SELECT * FROM tab_date;
 id |     a      
----+------------
  1 | 2021-10-26
  2 | 2020-10-26
  3 | 2021-10-28
  4 | 2021-10-27
(4 rows)

delete from tab_date where a='2021-10-27';
DELETE 1
delete from tab_date where id=3;
DELETE 1
drop table tab_date;
DROP TABLE
--timestamp
drop table if exists tab_timestamp;
psql:sql/datatypes_simple.sql:191: NOTICE:  table "tab_timestamp" does not exist, skipping
DROP TABLE
CREATE TABLE tab_timestamp(a timestamptz,b timestamp);
CREATE TABLE
INSERT INTO tab_timestamp VALUES('2020-04-26 13:20:34 CST','2020-04-08 14:40:12+08');
INSERT 0 1
INSERT INTO tab_timestamp VALUES('2020-04-25 14:56:34','2020-04-09 18:54:12 CST');
INSERT 0 1
update tab_timestamp set a='2021-10-26 13:20:34 CST' where b = '2020-04-08 14:40:12+08';
UPDATE 1
update tab_timestamp set b='2021-10-08 14:40:12' where a='2021-10-27 03:20:34+08';
UPDATE 1
SELECT * FROM tab_timestamp ORDER by a;
           a            |          b          
------------------------+---------------------
 2020-04-25 14:56:34+08 | 2020-04-09 18:54:12
 2021-10-27 03:20:34+08 | 2021-10-08 14:40:12
(2 rows)

delete from tab_timestamp where a='2021-10-27 03:20:34+08';
DELETE 1
drop table tab_timestamp;
DROP TABLE
--Boolean Type-- 布尔类型
drop table if exists tab_boolean;
psql:sql/datatypes_simple.sql:203: NOTICE:  table "tab_boolean" does not exist, skipping
DROP TABLE
CREATE TABLE tab_boolean(a boolean,b boolean);
CREATE TABLE
INSERT INTO tab_boolean VALUES('true','false');
INSERT 0 1
INSERT INTO tab_boolean VALUES('1','0');
INSERT 0 1
INSERT INTO tab_boolean VALUES('on','off');
INSERT 0 1
INSERT INTO tab_boolean VALUES('ON','OFF');
INSERT 0 1
INSERT INTO tab_boolean VALUES('y','n');
INSERT 0 1
INSERT INTO tab_boolean VALUES('Y','N');
INSERT 0 1
INSERT INTO tab_boolean VALUES('yes','no');
INSERT 0 1
INSERT INTO tab_boolean VALUES('Yes','No');
INSERT 0 1
INSERT INTO tab_boolean VALUES('YES','NO');
INSERT 0 1
SELECT * FROM tab_boolean;
 a | b 
---+---
 t | f
 t | f
 t | f
 t | f
 t | f
 t | f
 t | f
 t | f
 t | f
(9 rows)

UPDATE tab_boolean set a='no' where b='false';
UPDATE 9
UPDATE tab_boolean set b='true' where a='no';
UPDATE 9
SELECT * FROM tab_boolean;
 a | b 
---+---
 f | t
 f | t
 f | t
 f | t
 f | t
 f | t
 f | t
 f | t
 f | t
(9 rows)

delete from tab_boolean where a='no';
DELETE 9
drop table tab_boolean;
DROP TABLE
--Enumerated Types--  枚举类型
CREATE TYPE mood AS ENUM ('sad', 'ok', 'happy');
CREATE TYPE
drop table if exists person cascade;
psql:sql/datatypes_simple.sql:224: NOTICE:  drop cascades to 6 other objects
DETAIL:  drop cascades to function hobbies(person)
drop cascades to table emp
drop cascades to view toyemp
drop cascades to function overpaid(emp)
drop cascades to table student
drop cascades to table stud_emp
DROP TABLE
CREATE TABLE person (id int2,a text,b mood);
CREATE TABLE
INSERT INTO person VALUES (1,'Moe', 'happy');
INSERT 0 1
INSERT INTO person VALUES (2,'Larry', 'sad');
INSERT 0 1
INSERT INTO person VALUES (3,DEFAULT, DEFAULT);
INSERT 0 1
select * from person;
 id |   a   |   b   
----+-------+-------
  1 | Moe   | happy
  2 | Larry | sad
  3 |       | 
(3 rows)

UPDATE person set a='Curly' where id=3;
UPDATE 1
UPDATE person set b='ok' where id=3;
UPDATE 1
select * from person;
 id |   a   |   b   
----+-------+-------
  1 | Moe   | happy
  2 | Larry | sad
  3 | Curly | ok
(3 rows)

SELECT * FROM person WHERE b > 'sad';
 id |   a   |   b   
----+-------+-------
  1 | Moe   | happy
  3 | Curly | ok
(2 rows)

SELECT * FROM person WHERE b > 'sad' ORDER BY b;
 id |   a   |   b   
----+-------+-------
  3 | Curly | ok
  1 | Moe   | happy
(2 rows)

delete from person where b='ok';
DELETE 1
drop table person;
DROP TABLE
DROP TYPE mood; 
DROP TYPE
--Network Address Types-- 网络地址类型
drop table if exists tab_icm;
psql:sql/datatypes_simple.sql:243: NOTICE:  table "tab_icm" does not exist, skipping
DROP TABLE
CREATE TABLE tab_icm(aa int,a cidr,b inet,c macaddr);
CREATE TABLE
INSERT INTO tab_icm VALUES(1,DEFAULT,'10.10.20.10','00-50-56-C0-00-07');
INSERT 0 1
INSERT INTO tab_icm VALUES(2,'10.10/16',DEFAULT,'00-50-56-C0-00-08');
INSERT 0 1
INSERT INTO tab_icm VALUES(3,'10/8','fe80::81a7:c17c:788c:7723','00-50-56-C0-00-01');
INSERT 0 1
SELECT * FROM tab_icm; 
 aa |      a       |             b             |         c         
----+--------------+---------------------------+-------------------
  1 |              | 10.10.20.10               | 00:50:56:c0:00:07
  2 | 10.10.0.0/16 |                           | 00:50:56:c0:00:08
  3 | 10.0.0.0/8   | fe80::81a7:c17c:788c:7723 | 00:50:56:c0:00:01
(3 rows)

UPDATE tab_icm set a='10.10.20.10/32' where aa=1;
UPDATE 1
UPDATE tab_icm set b='::10.2.3.4' where aa=2;
UPDATE 1
UPDATE tab_icm set c='00-50-56-C0-00-09' where aa=3;
UPDATE 1
SELECT * FROM tab_icm;
 aa |       a        |             b             |         c         
----+----------------+---------------------------+-------------------
  1 | 10.10.20.10/32 | 10.10.20.10               | 00:50:56:c0:00:07
  2 | 10.10.0.0/16   | ::10.2.3.4                | 00:50:56:c0:00:08
  3 | 10.0.0.0/8     | fe80::81a7:c17c:788c:7723 | 00:50:56:c0:00:09
(3 rows)

drop table tab_icm;
DROP TABLE
-- Bit String Types--位串类型
drop table if exists tab_bit_string;
psql:sql/datatypes_simple.sql:257: NOTICE:  table "tab_bit_string" does not exist, skipping
DROP TABLE
CREATE TABLE tab_bit_string (id int2,a BIT(3));
CREATE TABLE
INSERT INTO tab_bit_string VALUES (1,B'101');
INSERT 0 1
INSERT INTO tab_bit_string VALUES (2,B'10'::bit(3));
INSERT 0 1
select * from tab_bit_string;
 id |  a  
----+-----
  1 | 101
  2 | 100
(2 rows)

UPDATE tab_bit_string set a=B'010' where id=1;
UPDATE 1
select * from tab_bit_string order by id;
 id |  a  
----+-----
  1 | 010
  2 | 100
(2 rows)

delete from tab_bit_string where id =2;
DELETE 1
SELECT * FROM tab_bit_string;
 id |  a  
----+-----
  1 | 010
(1 row)

drop table tab_bit_string;
DROP TABLE
--JSON Types
drop table if exists tab_json;
psql:sql/datatypes_simple.sql:275: NOTICE:  table "tab_json" does not exist, skipping
DROP TABLE
CREATE TABLE tab_json(id int2,a json);
CREATE TABLE
INSERT INTO tab_json VALUES(1,'{"广东省": "深圳市", "江苏省": "南京市", "甘肃省": "兰州市"}');
INSERT 0 1
 
INSERT INTO tab_json VALUES(2,'{"四川省": "成都市", "湖北省": "武汉市", "陕西省": "西安市"}');
INSERT 0 1
SELECT * FROM tab_json;
 id |                              a                               
----+--------------------------------------------------------------
  1 | {"广东省": "深圳市", "江苏省": "南京市", "甘肃省": "兰州市"}
  2 | {"四川省": "成都市", "湖北省": "武汉市", "陕西省": "西安市"}
(2 rows)

UPDATE tab_json set a='{"广东省": "广州市", "江苏省": "南京市", "甘肃省": "兰州市"}' where id=1;
UPDATE 1
SELECT * FROM tab_json order by id;
 id |                              a                               
----+--------------------------------------------------------------
  1 | {"广东省": "广州市", "江苏省": "南京市", "甘肃省": "兰州市"}
  2 | {"四川省": "成都市", "湖北省": "武汉市", "陕西省": "西安市"}
(2 rows)

delete from tab_json where id =2;
DELETE 1
drop table tab_json;
DROP TABLE
 
--pg_lsn Type pg_lsn 类型
drop table if exists tab_pg_lsn;
psql:sql/datatypes_simple.sql:290: NOTICE:  table "tab_pg_lsn" does not exist, skipping
DROP TABLE
create table tab_pg_lsn (id int2, a pg_lsn);
CREATE TABLE
insert into tab_pg_lsn values (1,'0/0');
INSERT 0 1
insert into tab_pg_lsn values (2,'0/12345678');
INSERT 0 1
UPDATE tab_pg_lsn set a='1/1' where id=1;
UPDATE 1
delete from tab_pg_lsn where id =2;
DELETE 1
drop table tab_pg_lsn;
DROP TABLE
 
--Object Identifier Types 对象标识符类型
drop table if exists tab_oid;
psql:sql/datatypes_simple.sql:300: NOTICE:  table "tab_oid" does not exist, skipping
DROP TABLE
CREATE TABLE tab_oid(id int, a oid);
CREATE TABLE
INSERT INTO tab_oid VALUES (1,'1234');
INSERT 0 1
INSERT INTO tab_oid VALUES (2,'987');
INSERT 0 1
INSERT INTO tab_oid VALUES (3,'   10  ');
INSERT 0 1
select * from tab_oid;
 id |  a   
----+------
  1 | 1234
  2 |  987
  3 |   10
(3 rows)

UPDATE tab_oid set a='9999999' where id=1;
UPDATE 1
UPDATE tab_oid set a='-1040' where id=2;
UPDATE 1
delete from tab_oid where id =3;
DELETE 1
select * from tab_oid order by id;
 id |     a      
----+------------
  1 |    9999999
  2 | 4294966256
(2 rows)

drop table tab_oid;
DROP TABLE
--UUID Type-- UUID类型
drop table if exists tab_uuid;
psql:sql/datatypes_simple.sql:314: NOTICE:  table "tab_uuid" does not exist, skipping
DROP TABLE
create table tab_uuid(id int2, a uuid);
CREATE TABLE
insert into tab_uuid values(1,'11111111-1111-1111-1111-111111111111');
INSERT 0 1
insert into tab_uuid values(2,'a0eebc99-9c0b-4ef8-bb6d-6bb9bd380a11');
INSERT 0 1
select * from tab_uuid;
 id |                  a                   
----+--------------------------------------
  1 | 11111111-1111-1111-1111-111111111111
  2 | a0eebc99-9c0b-4ef8-bb6d-6bb9bd380a11
(2 rows)

UPDATE tab_uuid set a='22222222-2222-2222-2222-222222222222' where id=1;
UPDATE 1
delete from tab_uuid where id =2;
DELETE 1
select * from tab_uuid;
 id |                  a                   
----+--------------------------------------
  1 | 22222222-2222-2222-2222-222222222222
(1 row)

drop table tab_uuid;
DROP TABLE
-- XML Type--XML类型
--drop table if exists tab_xml;
--create table tab_xml(id int2, a xml);
--INSERT INTO tab_xml VALUES (1, '<value>one</value>');
--INSERT INTO tab_xml VALUES (2, '<value>two</value>');
--select * from tab_xml;
--UPDATE tab_xml set a='<value>three</value>' where id=1;
--UPDATE tab_xml set a='<value>four</value>' where id=2;
--delete from tab_xml where id =2;
--drop table tab_xml;
--Range Types  范围类型
--drop table if exists tab_range;
--create table tab_range(id int2,a int4range,b int8range,c numrange);
--insert into tab_range values (1,'[2,8]','[-2,88)','[3.14,55.14]');
--insert into tab_range values (2,int4range(123,123,'[]'),int8range(456,789,'[)'),numrange(222.22,333.33,'()'));
--select * from tab_range
--UPDATE tab_range set a='[1,9]' where id=1;
--UPDATE tab_range set b='[-88,2)' where id=1;
--UPDATE tab_range set c='[-3.14,55.14]' where id=1;
--select * from tab_range order by id;
--delete from tab_range where a='[1,9]';
--drop table tab_range;
--drop table if exists tab_range2;
--create table tab_range2(id int2,a tsrange,b tstzrange,c daterange);
--insert into tab_range2 VALUES(1,
--'[2010-01-01 14:30, 2010-01-01 15:30)',
--'[2011-01-01 16:30, 2011-01-01 17:30]',
--'[2011-01-01,2012-01-01]');
--UPDATE tab_range2 set c='[2020-01-01,2021-01-01]' where id=1;
--delete from tab_range2 where id=1;
--drop table tab_range2;
--Domain Types 域类型
--CREATE DOMAIN posint AS integer CHECK (VALUE > 0);
--drop table if exists mytable;
--CREATE TABLE mytable (id posint,a int2);
--INSERT INTO mytable VALUES(1,123);
--INSERT INTO mytable VALUES(10,456);
--select * from mytable;
--UPDATE mytable set id=2 where a=456;
--UPDATE mytable set id=-1 where a=123;
--delete from mytable where id =2;
--drop table mytable;
--drop domain posint;
--Arrays  数组
--drop table if exists tab_array;
--CREATE TABLE tab_array(id int2,a text[],b integer[][],c integer ARRAY[3]);
--INSERT INTO tab_array VALUES(1,'{"江苏省","甘肃省","北京市"}','{1,2,3,4,5}','{21,22,31}');
--INSERT INTO tab_array VALUES(2,'{"天津市","湖北省","陕西市"}','{5,4,3,2,1}','{21,22,31,44}');
--UPDATE tab_array set a='{"江苏省","甘肃省","广东省"}' where id=1;
--UPDATE tab_array set b[1]='广州市' where id=2;
--delete from tab_array where id =1;
--SELECT * FROM tab_array;
--SELECT a[1],b[3],c[4] FROM tab_array;
 
--drop table tab_array;
 
 
 
 
--Composite Types 组合类型
 
--CREATE TYPE tab_com AS (
--    name            text,
--    supplier_id     integer,
--    price           numeric
--);
--CREATE FUNCTION price_extension(tab_com, integer) RETURNS numeric
--AS 'SELECT $1.price * $2' LANGUAGE SQL;
--CREATE TABLE on_hand ( item      tab_com, count     integer);
--INSERT INTO on_hand VALUES (ROW('fuzzy dice', 42, 1.99), 1000);
--SELECT price_extension(item, 10) FROM on_hand;
--SELECT * FROM on_hand;
--drop table on_hand;
--Geometric Types 几何类型
--drop table if exists tab_geometric;
--CREATE TABLE tab_geometric(id int2,a point,b lseg,c box,d path,e path,f polygon,j circle);
--INSERT INTO tab_geometric VALUES(1,'(1,2)',
--'[(1,2),(2,3)]',
--'((1,2),(1,3))',
--'[(1,2),(2,3),(2,4),(1,3),(0,2)]',
--'[(1,2),(2,3),(3,4)]',
--'((1,2),(2,3),(2,4),(1,3),(0,2))',
--'<(2,3),3>');
--SELECT * FROM tab_geometric;
--drop table tab_geometric;
