create type vihicles as enum ('car', 'suv', 'truck', 'mpv', 'wagon', 'hatchback');
drop table if exists tvehicles;
NOTICE:  table "tvehicles" does not exist, skipping
create table tvehicles (a int, b vihicles);
insert into tvehicles values(1, 'car'),(2, 'suv'),(3, 'truck'),(4, 'hatchback'),(5, 'mpv'), (6, 'wagon');
select*from tvehicles;
 a |     b     
---+-----------
 1 | car
 2 | suv
 3 | truck
 4 | hatchback
 5 | mpv
 6 | wagon
(6 rows)

select*from tvehicles where b > 'suv';
 a |     b     
---+-----------
 3 | truck
 4 | hatchback
 5 | mpv
 6 | wagon
(4 rows)

select*from tvehicles where b <= 'mpv';
 a |   b   
---+-------
 1 | car
 2 | suv
 3 | truck
 5 | mpv
(4 rows)

select*from tvehicles where a>2;
 a |     b     
---+-----------
 3 | truck
 4 | hatchback
 5 | mpv
 6 | wagon
(4 rows)

select*from tvehicles where b='suv';
 a |  b  
---+-----
 2 | suv
(1 row)

update tvehicles set b='mpv' where b='truck';
select*from tvehicles;
 a |     b     
---+-----------
 1 | car
 2 | suv
 3 | mpv
 4 | hatchback
 5 | mpv
 6 | wagon
(6 rows)

delete from tvehicles where b='mpv';
select*from tvehicles;
 a |     b     
---+-----------
 1 | car
 2 | suv
 4 | hatchback
 6 | wagon
(4 rows)

delete from tvehicles where b='suv';
select*from tvehicles;
 a |     b     
---+-----------
 1 | car
 4 | hatchback
 6 | wagon
(3 rows)

update tvehicles set b='mpv';
select*from tvehicles;
 a |  b  
---+-----
 1 | mpv
 4 | mpv
 6 | mpv
(3 rows)

