drop table if exists t1;
DROP TABLE
drop table if exists t100;
psql:sql/remote_dml.sql:2: NOTICE:  table "t100" does not exist, skipping
DROP TABLE
drop table if exists t101;
psql:sql/remote_dml.sql:3: NOTICE:  table "t101" does not exist, skipping
DROP TABLE
drop table if exists t102;
psql:sql/remote_dml.sql:4: NOTICE:  table "t102" does not exist, skipping
DROP TABLE
drop table if exists t103;
psql:sql/remote_dml.sql:5: NOTICE:  table "t103" does not exist, skipping
DROP TABLE
create table t1(a int primary key, b serial) partition by hash(a);
CREATE TABLE
create table t100 partition of t1 for values with (modulus 4, remainder 0); 
CREATE TABLE
create table t101 partition of t1 for values with (modulus 4, remainder 1); 
CREATE TABLE
create table t102 partition of t1 for values with (modulus 4, remainder 2); 
CREATE TABLE
create table t103 partition of t1 for values with (modulus 4, remainder 3); 
CREATE TABLE
insert into t1 values(1),(2),(3),(4),(5),(6),(7),(8),(9),(10),(11),(12),(13),(14),(15),(16),(17),(18),(19),(20);
INSERT 0 20
select*from t1;
 a  | b  
----+----
  1 |  1
 12 | 12
 14 | 14
 16 | 16
 17 | 17
  3 |  3
  5 |  5
  8 |  8
  9 |  9
 11 | 11
 19 | 19
 20 | 20
  2 |  2
 13 | 13
 18 | 18
  4 |  4
  6 |  6
  7 |  7
 10 | 10
 15 | 15
(20 rows)

select a from t1 where a between 3 and 11;
 a  
----
  3
  5
  8
  9
 11
  4
  6
  7
 10
(9 rows)

select * from t1 where a in (3,7,11, 13);
 a  | b  
----+----
  3 |  3
 11 | 11
 13 | 13
  7 |  7
(4 rows)

--update t1 set a=a+1 where a > 1 and a < 5;
delete from t1 where a %5=0;
DELETE 4
select * from t1 where a %5=0;
 a | b 
---+---
(0 rows)

select*from t1;
 a  | b  
----+----
  1 |  1
 12 | 12
 14 | 14
 16 | 16
 17 | 17
  3 |  3
  8 |  8
  9 |  9
 11 | 11
 19 | 19
  2 |  2
 13 | 13
 18 | 18
  4 |  4
  6 |  6
  7 |  7
(16 rows)

--start transaction;
delete from t1 where a > 10;
DELETE 8
select*from t1;
 a | b 
---+---
 1 | 1
 3 | 3
 8 | 8
 9 | 9
 2 | 2
 4 | 4
 6 | 6
 7 | 7
(8 rows)

create table tfail(a int);
CREATE TABLE
delete from t1;
DELETE 8
select*from t1;
 a | b 
---+---
(0 rows)

commit;
psql:sql/remote_dml.sql:26: WARNING:  there is no transaction in progress
COMMIT
--start transaction;
delete from t1;
DELETE 0
select*from t1;
 a | b 
---+---
(0 rows)

rollback;
psql:sql/remote_dml.sql:31: WARNING:  there is no transaction in progress
ROLLBACK
select*from t1;
 a | b 
---+---
(0 rows)

drop table if exists t2;
DROP TABLE
-- create table t2(a int primary key, b timestamptz default now(), c varchar(32) default 'xyz');
create table t2(a int primary key, b timestamptz default '2022-06-01 16:00:00+08', c varchar(32) default 'xyz');
CREATE TABLE
--start transaction;
insert into t2 values(1) returning *;
 a |           b            |  c  
---+------------------------+-----
 1 | 2022-06-01 16:00:00+08 | xyz
(1 row)

INSERT 0 1
insert into t2 values(8, NULL, 'xxx'),(9, NULL, NULL) returning *;
 a | b |  c  
---+---+-----
 8 |   | xxx
 9 |   | 
(2 rows)

INSERT 0 2
-- insert into t2 values(10, now(), 'abc'),(11, '2006-06-02 13:36:35+08', '你好');
insert into t2 values(10, '2022-06-01 17:00:00+08', 'abc'),(11, '2006-06-02 13:36:35+08', '你好');
INSERT 0 2
commit;
psql:sql/remote_dml.sql:42: WARNING:  there is no transaction in progress
COMMIT
insert into t2 values(1) returning *;
psql:sql/remote_dml.sql:44: ERROR:  Kunlun-db: MySQL storage node (1, 1) returned error: 1062, Duplicate entry '1' for key 't2.PRIMARY'.
begin;
BEGIN
insert into t2 values(1) returning *;
psql:sql/remote_dml.sql:47: ERROR:  Kunlun-db: MySQL storage node (1, 1) returned error: 1062, Duplicate entry '1' for key 't2.PRIMARY'.
commit;
ROLLBACK
select*from t2;
 a  |           b            |  c   
----+------------------------+------
  1 | 2022-06-01 16:00:00+08 | xyz
  8 |                        | xxx
  9 |                        | 
 10 | 2022-06-01 17:00:00+08 | abc
 11 | 2006-06-02 13:36:35+08 | 你好
(5 rows)

drop table if exists t3;
DROP TABLE
drop table if exists t301;
psql:sql/remote_dml.sql:54: NOTICE:  table "t301" does not exist, skipping
DROP TABLE
drop table if exists t302;
psql:sql/remote_dml.sql:55: NOTICE:  table "t302" does not exist, skipping
DROP TABLE
create table t3(a int, b varchar(16) NOT NULL, c int, primary key(b,a)) partition by list(a);
CREATE TABLE
create table t301 partition of t3 for values in (1,3,5,7,9);
CREATE TABLE
create table t302 partition of t3 for values in (2,4,6, 8, 10);
CREATE TABLE
insert into t3 values (1, 'amd', 24254),(2, 'intel', 325332),(3, 'broadcom', 345220),(4, 'nvidia', 87902),(5, 'huawei',89790),(6, 'apple',45232);
INSERT 0 6
create index on t3(c);
CREATE INDEX
select*from t3 where c > 100000;
 a |    b     |   c    
---+----------+--------
 3 | broadcom | 345220
 2 | intel    | 325332
(2 rows)

drop table if exists t5;
DROP TABLE
drop table if exists t501;
psql:sql/remote_dml.sql:64: NOTICE:  table "t501" does not exist, skipping
DROP TABLE
drop table if exists t502;
psql:sql/remote_dml.sql:65: NOTICE:  table "t502" does not exist, skipping
DROP TABLE
drop table if exists t503;
psql:sql/remote_dml.sql:66: NOTICE:  table "t503" does not exist, skipping
DROP TABLE
drop table if exists t504;
psql:sql/remote_dml.sql:67: NOTICE:  table "t504" does not exist, skipping
DROP TABLE
-- create table t5(a int primary key, b timestamptz default now(), c varchar(32) default 'abc') partition by range(a);
create table t5(a int primary key, b timestamptz default '2022-06-01 16:00:00+08', c varchar(32) default 'abc') partition by range(a);
CREATE TABLE
create table t501 partition of t5 for values from (MINVALUE) to (10);
CREATE TABLE
create table t502 partition of t5 for values from (10) to (20);
CREATE TABLE
create table t503 partition of t5 for values from (20) to (30);
CREATE TABLE
create table t504 partition of t5 for values from (30) to (MAXVALUE);
CREATE TABLE
insert into t5 values(-10),(0), (15),(40) returning *;
  a  |           b            |  c  
-----+------------------------+-----
 -10 | 2022-06-01 16:00:00+08 | abc
   0 | 2022-06-01 16:00:00+08 | abc
  15 | 2022-06-01 16:00:00+08 | abc
  40 | 2022-06-01 16:00:00+08 | abc
(4 rows)

INSERT 0 4
insert into t5 values(-20),(10), (25),(400);
INSERT 0 4
select*from t5 where a between 30 and 100;
 a  |           b            |  c  
----+------------------------+-----
 40 | 2022-06-01 16:00:00+08 | abc
(1 row)

PREPARE q1(int, int) AS SELECT * FROM t5 WHERE a between $1 and $2 order by 1;
PREPARE
EXECUTE q1(-100, 20);
  a  |           b            |  c  
-----+------------------------+-----
 -20 | 2022-06-01 16:00:00+08 | abc
 -10 | 2022-06-01 16:00:00+08 | abc
   0 | 2022-06-01 16:00:00+08 | abc
  10 | 2022-06-01 16:00:00+08 | abc
  15 | 2022-06-01 16:00:00+08 | abc
(5 rows)

EXECUTE q1(0, 40);
 a  |           b            |  c  
----+------------------------+-----
  0 | 2022-06-01 16:00:00+08 | abc
 10 | 2022-06-01 16:00:00+08 | abc
 15 | 2022-06-01 16:00:00+08 | abc
 25 | 2022-06-01 16:00:00+08 | abc
 40 | 2022-06-01 16:00:00+08 | abc
(5 rows)

PREPARE q2(int, int) AS SELECT * FROM t1 WHERE a between $1 and $2 order by 1;
PREPARE
EXECUTE q2(0, 10);
 a | b 
---+---
(0 rows)

EXECUTE q1(10, 30);
 a  |           b            |  c  
----+------------------------+-----
 10 | 2022-06-01 16:00:00+08 | abc
 15 | 2022-06-01 16:00:00+08 | abc
 25 | 2022-06-01 16:00:00+08 | abc
(3 rows)

EXECUTE q2(5, 40);
 a | b 
---+---
(0 rows)

deallocate q1;
DEALLOCATE
drop table if exists t4 cascade;
DROP TABLE
create table t4(a int primary key, b serial);
CREATE TABLE
insert into t4 values(1),(2),(3),(4),(5),(6),(7),(8),(9),(10),(11),(12),(13),(14),(15),(16),(17),(18),(19),(20);
INSERT 0 20
PREPARE q3(int, int) AS SELECT * FROM t4 WHERE a between $1 and $2;
PREPARE
EXECUTE q3(6, 16);
 a  | b  
----+----
  6 |  6
  7 |  7
  8 |  8
  9 |  9
 10 | 10
 11 | 11
 12 | 12
 13 | 13
 14 | 14
 15 | 15
 16 | 16
(11 rows)

EXECUTE q1(0, 30);
psql:sql/remote_dml.sql:99: ERROR:  prepared statement "q1" does not exist
EXECUTE q2(5, 10);
 a | b 
---+---
(0 rows)

deallocate q2;
DEALLOCATE
EXECUTE q3(0, 40);
 a  | b  
----+----
  1 |  1
  2 |  2
  3 |  3
  4 |  4
  5 |  5
  6 |  6
  7 |  7
  8 |  8
  9 |  9
 10 | 10
 11 | 11
 12 | 12
 13 | 13
 14 | 14
 15 | 15
 16 | 16
 17 | 17
 18 | 18
 19 | 19
 20 | 20
(20 rows)

PREPARE q4(int, int) as update t1 set b=$1 where a=$2;
PREPARE
select*from t1;
 a | b 
---+---
(0 rows)

EXECUTE q4(10, 9);
UPDATE 0
EXECUTE q3(0, 40);
 a  | b  
----+----
  1 |  1
  2 |  2
  3 |  3
  4 |  4
  5 |  5
  6 |  6
  7 |  7
  8 |  8
  9 |  9
 10 | 10
 11 | 11
 12 | 12
 13 | 13
 14 | 14
 15 | 15
 16 | 16
 17 | 17
 18 | 18
 19 | 19
 20 | 20
(20 rows)

EXECUTE q4(11, 10);
UPDATE 0
prepare q6(int) as insert into t5 values($1);
PREPARE
EXECUTE q6(1);
INSERT 0 1
EXECUTE q6(2);
INSERT 0 1
begin;
BEGIN
EXECUTE q6(12);
INSERT 0 1
EXECUTE q4(14, 13);
UPDATE 0
EXECUTE q6(13);
INSERT 0 1
commit;
COMMIT
EXECUTE q6(21);
INSERT 0 1
EXECUTE q6(22);
INSERT 0 1
EXECUTE q6(23);
INSERT 0 1
begin;
BEGIN
EXECUTE q6(31);
INSERT 0 1
EXECUTE q6(33);
INSERT 0 1
select*from t5 order by 1;
  a  |           b            |  c  
-----+------------------------+-----
 -20 | 2022-06-01 16:00:00+08 | abc
 -10 | 2022-06-01 16:00:00+08 | abc
   0 | 2022-06-01 16:00:00+08 | abc
   1 | 2022-06-01 16:00:00+08 | abc
   2 | 2022-06-01 16:00:00+08 | abc
  10 | 2022-06-01 16:00:00+08 | abc
  12 | 2022-06-01 16:00:00+08 | abc
  13 | 2022-06-01 16:00:00+08 | abc
  15 | 2022-06-01 16:00:00+08 | abc
  21 | 2022-06-01 16:00:00+08 | abc
  22 | 2022-06-01 16:00:00+08 | abc
  23 | 2022-06-01 16:00:00+08 | abc
  25 | 2022-06-01 16:00:00+08 | abc
  31 | 2022-06-01 16:00:00+08 | abc
  33 | 2022-06-01 16:00:00+08 | abc
  40 | 2022-06-01 16:00:00+08 | abc
 400 | 2022-06-01 16:00:00+08 | abc
(17 rows)

commit;
COMMIT
prepare q5(varchar(32), int, varchar(32)) as update  t5 set c=$1 where a%7=$2 and c=$3;
PREPARE
begin;
BEGIN
EXECUTE q5('def', 3, 'abc');
UPDATE 2
EXECUTE q6(3);
INSERT 0 1
EXECUTE q6(4);
INSERT 0 1
commit;
COMMIT
EXECUTE q6(11);
INSERT 0 1
EXECUTE q6(32);
INSERT 0 1
EXECUTE q3(0, 40);
 a  | b  
----+----
  1 |  1
  2 |  2
  3 |  3
  4 |  4
  5 |  5
  6 |  6
  7 |  7
  8 |  8
  9 |  9
 10 | 10
 11 | 11
 12 | 12
 13 | 13
 14 | 14
 15 | 15
 16 | 16
 17 | 17
 18 | 18
 19 | 19
 20 | 20
(20 rows)

deallocate q3;
DEALLOCATE
EXECUTE q3(10, 40);
psql:sql/remote_dml.sql:144: ERROR:  prepared statement "q3" does not exist
begin;
BEGIN
EXECUTE q4(12, 11);
UPDATE 0
select*from t1 where a between 9 and 12;
 a | b 
---+---
(0 rows)

select*from t5 order by 1;
  a  |           b            |  c  
-----+------------------------+-----
 -20 | 2022-06-01 16:00:00+08 | abc
 -10 | 2022-06-01 16:00:00+08 | abc
   0 | 2022-06-01 16:00:00+08 | abc
   1 | 2022-06-01 16:00:00+08 | abc
   2 | 2022-06-01 16:00:00+08 | abc
   3 | 2022-06-01 16:00:00+08 | abc
   4 | 2022-06-01 16:00:00+08 | abc
  10 | 2022-06-01 16:00:00+08 | def
  11 | 2022-06-01 16:00:00+08 | abc
  12 | 2022-06-01 16:00:00+08 | abc
  13 | 2022-06-01 16:00:00+08 | abc
  15 | 2022-06-01 16:00:00+08 | abc
  21 | 2022-06-01 16:00:00+08 | abc
  22 | 2022-06-01 16:00:00+08 | abc
  23 | 2022-06-01 16:00:00+08 | abc
  25 | 2022-06-01 16:00:00+08 | abc
  31 | 2022-06-01 16:00:00+08 | def
  32 | 2022-06-01 16:00:00+08 | abc
  33 | 2022-06-01 16:00:00+08 | abc
  40 | 2022-06-01 16:00:00+08 | abc
 400 | 2022-06-01 16:00:00+08 | abc
(21 rows)

EXECUTE q5('xyz', 3, 'def');
UPDATE 2
EXECUTE q5('XYZ', 4, 'abc');
UPDATE 4
commit;
COMMIT
EXECUTE q5('MNO', 5, 'abc');
UPDATE 3
select*from t5 where a%7=3 or a%7=4 or a%7=5 order by 1;
 a  |           b            |  c  
----+------------------------+-----
  3 | 2022-06-01 16:00:00+08 | abc
  4 | 2022-06-01 16:00:00+08 | XYZ
 10 | 2022-06-01 16:00:00+08 | xyz
 11 | 2022-06-01 16:00:00+08 | XYZ
 12 | 2022-06-01 16:00:00+08 | MNO
 25 | 2022-06-01 16:00:00+08 | XYZ
 31 | 2022-06-01 16:00:00+08 | xyz
 32 | 2022-06-01 16:00:00+08 | XYZ
 33 | 2022-06-01 16:00:00+08 | MNO
 40 | 2022-06-01 16:00:00+08 | MNO
(10 rows)

EXECUTE q5('qps', 11, 'XYZ');
UPDATE 0
deallocate q4;
DEALLOCATE
deallocate q5;
DEALLOCATE
create table t31(a int primary key, b int, c int, d int);
CREATE TABLE
insert into t31 values
(21 ,  1 , 21 ,  1),
( 22 ,  2 , 22 ,  2),
( 23 ,  3 , 23 ,  3),
( 24 , 14 , 24 ,  4),
( 25 , 15 , 25 ,  5);
INSERT 0 5
select a,b,c, case a%2 when 0 then b when 1 then c end as x from t31 where (case when b > 10 then b%3=2 when b <10 then b%2=1 end);
 a  | b  | c  | x  
----+----+----+----
 21 |  1 | 21 | 21
 23 |  3 | 23 | 23
 24 | 14 | 24 | 14
(3 rows)

select count(*) from t2 where b <= current_timestamp;
 count 
-------
     3
(1 row)

select * from t31 where a=any(select b+23 from t31);
 a  | b  | c  | d 
----+----+----+---
 24 | 14 | 24 | 4
 25 | 15 | 25 | 5
(2 rows)

select * from t31 where a=all(select b+23 from t31);
 a | b | c | d 
---+---+---+---
(0 rows)

select * from t31 where a!=all(values(1),(21),(23));
 a  | b  | c  | d 
----+----+----+---
 22 |  2 | 22 | 2
 24 | 14 | 24 | 4
 25 | 15 | 25 | 5
(3 rows)

select * from t31 where a=any(values(1),(21),(22));
 a  | b | c  | d 
----+---+----+---
 21 | 1 | 21 | 1
 22 | 2 | 22 | 2
(2 rows)

select greatest(a,b,c) as g, least(a,b,c) as l from t31;
 g  | l  
----+----
 21 |  1
 22 |  2
 23 |  3
 24 | 14
 25 | 15
(5 rows)

select greatest(a,b,c) as g, least(a,b,c) as l, coalesce(null,a,b,c) from t31;
 g  | l  | coalesce 
----+----+----------
 21 |  1 |       21
 22 |  2 |       22
 23 |  3 |       23
 24 | 14 |       24
 25 | 15 |       25
(5 rows)

drop table t31;
DROP TABLE
drop table t2;
DROP TABLE
drop table t1;
DROP TABLE
drop table t4;
DROP TABLE
drop table t5;
DROP TABLE
