-- regression test cases from all bug reports in trac.
-- bug 17 The command does not return the number of affected records 
create table tx1(id int primary key, c char(50));
insert into tx1 values(1,'1');
insert into tx1 values(2, '2');
insert into tx1 values(3, '3');
delete from tx1;
drop table tx1;
-- bug 30
create table uv_iocu_tab (a serial primary key, b varchar(50));
insert into uv_iocu_tab (b) values('abc'),('bcd'),('xyz');
create view uv_iocu_view as select b as bb, a as aa, uv_iocu_tab::varchar(50) as cc from uv_iocu_tab;
select * from uv_iocu_view;
ERROR:  Kunlun-db: Must specify whole-row target left-most.
drop view uv_iocu_view;
create view uv_iocu_view as select a as aa, b as bb, uv_iocu_tab::varchar(50) as cc from uv_iocu_tab;
select * from uv_iocu_view;
 aa | bb  |   cc    
----+-----+---------
  1 | abc | (1,abc)
  2 | bcd | (2,bcd)
  3 | xyz | (3,xyz)
(3 rows)

drop table uv_iocu_tab cascade;
NOTICE:  drop cascades to view uv_iocu_view
-- bug 31
CREATE TABLE base_tbl(id serial primary key, a float);
INSERT INTO base_tbl (a) SELECT i/10.0 FROM generate_series(1,10) g(i);
CREATE VIEW rw_view1 AS SELECT ctid, sin(a) s, a, cos(a) c FROM base_tbl WHERE a != 0 ORDER BY abs(a);
select*from rw_view1;
ERROR:  Kunlun-db: Can't access system attribute(ctid) from remote relation base_tbl.
drop view rw_view1;
CREATE VIEW rw_view1 AS SELECT sin(a) s, a, cos(a) c FROM base_tbl WHERE a != 0 ORDER BY abs(a);
select*from rw_view1;
         s          |  a  |         c         
--------------------+-----+-------------------
 0.0998334166468282 | 0.1 | 0.995004165278026
  0.198669330795061 | 0.2 | 0.980066577841242
   0.29552020666134 | 0.3 | 0.955336489125606
  0.389418342308651 | 0.4 | 0.921060994002885
  0.479425538604203 | 0.5 | 0.877582561890373
  0.564642473395035 | 0.6 | 0.825335614909678
  0.644217687237691 | 0.7 | 0.764842187284488
  0.717356090899523 | 0.8 | 0.696706709347165
  0.783326909627483 | 0.9 | 0.621609968270664
  0.841470984807897 |   1 |  0.54030230586814
(10 rows)

INSERT INTO rw_view1 (a) VALUES (1.1) RETURNING a, s, c;
  a  |         s         |         c         
-----+-------------------+-------------------
 1.1 | 0.891207360061435 | 0.453596121425577
(1 row)

select*from rw_view1;
         s          |  a  |         c         
--------------------+-----+-------------------
 0.0998334166468282 | 0.1 | 0.995004165278026
  0.198669330795061 | 0.2 | 0.980066577841242
   0.29552020666134 | 0.3 | 0.955336489125606
  0.389418342308651 | 0.4 | 0.921060994002885
  0.479425538604203 | 0.5 | 0.877582561890373
  0.564642473395035 | 0.6 | 0.825335614909678
  0.644217687237691 | 0.7 | 0.764842187284488
  0.717356090899523 | 0.8 | 0.696706709347165
  0.783326909627483 | 0.9 | 0.621609968270664
  0.841470984807897 |   1 |  0.54030230586814
  0.891207360061435 | 1.1 | 0.453596121425577
(11 rows)

drop table base_tbl cascade;
NOTICE:  drop cascades to view rw_view1
-- bug 29
CREATE TABLE base_tbl (a int PRIMARY KEY, b varchar(50) DEFAULT 'Unspecified');
INSERT INTO base_tbl SELECT i, 'Row ' i FROM generate_series(-2, 2) g(i);
CREATE VIEW rw_view16 AS SELECT a, b, a AS aa FROM base_tbl;
UPDATE rw_view16 SET aa=-3 WHERE a=3;
UPDATE rw_view16 SET aa=-5 WHERE a=5;
select*from rw_view16;
 a  |  b   | aa 
----+------+----
 -2 | Row  | -2
 -1 | Row  | -1
  0 | Row  |  0
  1 | Row  |  1
  2 | Row  |  2
(5 rows)

delete from rw_view16 where aa=2;
insert into rw_view16 values(4,'new row');
UPDATE rw_view16 SET aa=-4 WHERE a=4;
select*from rw_view16;
 a  |    b    | aa 
----+---------+----
 -4 | new row | -4
 -2 | Row     | -2
 -1 | Row     | -1
  0 | Row     |  0
  1 | Row     |  1
(5 rows)

drop table base_tbl cascade;
NOTICE:  drop cascades to view rw_view16
CREATE TABLE base_tbl(a int primary key, b varchar(50), c float);
CREATE VIEW rw_view2 AS SELECT b AS bb, c AS cc, a AS aa FROM base_tbl;
UPDATE base_tbl SET a=a, c=c;
NOTICE:  Kunlun-db: No target columns found in update statement UPDATE base_tbl SET a=a, c=c;, query execution skipped.
UPDATE rw_view2 SET bb=bb, cc=cc;
NOTICE:  Kunlun-db: No target columns found in update statement UPDATE rw_view2 SET bb=bb, cc=cc;, query execution skipped.
select*from base_tbl;
 a | b | c 
---+---+---
(0 rows)

select*from rw_view2;
 bb | cc | aa 
----+----+----
(0 rows)

drop table base_tbl cascade;
NOTICE:  drop cascades to view rw_view2
-- bug 39
CREATE TABLE SUBSELECT_TBL ( id serial primary key, f1 integer, f2 integer, f3 float );
INSERT INTO SUBSELECT_TBL (f1, f2, f3) VALUES (1, 2, 3), (2, 3, 4), (3, 4, 5), (1, 1, 1), (2, 2, 2), (3, 3, 3), (6, 7, 8), (8, 9, NULL);
SELECT f1 AS "Correlated Field", f2 AS "Second Field" FROM SUBSELECT_TBL upper WHERE f1 IN (SELECT f2 FROM SUBSELECT_TBL WHERE f1 = upper.f1);
 Correlated Field | Second Field 
------------------+--------------
                1 |            2
                2 |            3
                3 |            4
                1 |            1
                2 |            2
                3 |            3
(6 rows)

drop table SUBSELECT_TBL;
create temp table rngfunc(f1 int8, f2 int8);
create function testrngfunc() returns record as $$

    insert into rngfunc values (1,2) returning *;

$$ language sql;
select testrngfunc();
 testrngfunc 
-------------
 (1,2)
(1 row)

select * from testrngfunc() as t(f1 int8,f2 int8);
 f1 | f2 
----+----
  1 |  2
(1 row)

select * from testrngfunc() as t(f1 int8,f2 int8);
 f1 | f2 
----+----
  1 |  2
(1 row)

-- bug 48
create user userw;
ERROR:  role "userw" already exists
SELECT SESSION_USER, CURRENT_USER;
 session_user | current_user 
--------------+--------------
 dzw          | dzw
(1 row)

SET SESSION AUTHORIZATION userw;
create table testu1(id integer primary key, name varchar(50));
insert into testu1 values(1, 'userx');
insert into testu1 values(2, 'userw');
SELECT SESSION_USER, CURRENT_USER;
 session_user | current_user 
--------------+--------------
 userw        | userw
(1 row)

drop table testu1;
SET SESSION AUTHORIZATION dzw;
-- bug 51
CREATE TABLE r1 (id serial primary key, a int);
CREATE TABLE r2 (id serial primary key, a int);
INSERT INTO r1 (a) VALUES (10), (20);
INSERT INTO r2 (a) VALUES (10), (20);
INSERT INTO r1 (a) SELECT a + 1 FROM r2;
INSERT INTO r1 (a) SELECT a + 1 FROM r2 RETURNING *;
 id | a  
----+----
  5 | 11
  6 | 21
(2 rows)

select*from r1;
 id | a  
----+----
  1 | 10
  2 | 20
  3 | 11
  4 | 21
  5 | 11
  6 | 21
(6 rows)

select*from r2;
 id | a  
----+----
  1 | 10
  2 | 20
(2 rows)

drop table r1;
drop table r2;
-- bug 60
create table at_base_table(id int primary key, stuff text);
insert into at_base_table values (23, 'skidoo');
create view at_view_1 as select * from at_base_table bt;
create view at_view_2 as select *, to_json(v1) as j from at_view_1 v1;
explain (verbose, costs off) select * from at_view_2;
                                      QUERY PLAN                                       
---------------------------------------------------------------------------------------
 RemoteScan on public.at_base_table bt
   Output: bt.id, bt.stuff, to_json(ROW(bt.id, bt.stuff))
   Shard: 3      Remote SQL: select id, stuff from regression_$$_public.at_base_table 
(3 rows)

explain (verbose, costs off) select * from at_view_1;
                                      QUERY PLAN                                       
---------------------------------------------------------------------------------------
 RemoteScan on public.at_base_table bt
   Output: bt.id, bt.stuff
   Shard: 3      Remote SQL: select id, stuff from regression_$$_public.at_base_table 
(3 rows)

select * from at_view_2;
 id | stuff  |             j              
----+--------+----------------------------
 23 | skidoo | {"id":23,"stuff":"skidoo"}
(1 row)

select * from at_view_1;
 id | stuff  
----+--------
 23 | skidoo
(1 row)

drop table at_base_table cascade;
NOTICE:  drop cascades to 2 other objects
DETAIL:  drop cascades to view at_view_1
drop cascades to view at_view_2
-- bug 69
drop table if exists pagg_tab_m;
NOTICE:  table "pagg_tab_m" does not exist, skipping
CREATE TABLE pagg_tab_m (id serial , a int, b int, c int, primary key(id, a,b)) PARTITION BY RANGE(a, b);
CREATE TABLE pagg_tab_m_p1 PARTITION OF pagg_tab_m FOR VALUES FROM (0, 0) TO (10, 10);
CREATE TABLE pagg_tab_m_p2 PARTITION OF pagg_tab_m FOR VALUES FROM (10, 10) TO (20, 20);
CREATE TABLE pagg_tab_m_p3 PARTITION OF pagg_tab_m FOR VALUES FROM (20, 20) TO (30, 30);
INSERT INTO pagg_tab_m(a,b,c) SELECT i % 30, i % 40, i % 50 FROM generate_series(0, 2999) i;
EXPLAIN (COSTS OFF) SELECT a, sum(b), avg(c), count(*) FROM pagg_tab_m GROUP BY a, (a+b)/2 HAVING sum(b) < 50 ORDER BY 1, 2, 3;
                                                      QUERY PLAN                                                      
----------------------------------------------------------------------------------------------------------------------
 Sort
   Sort Key: pagg_tab_m_p1.id, (sum(pagg_tab_m_p1.b)), (avg(pagg_tab_m_p1.c))
   ->  HashAggregate
         Group Key: pagg_tab_m_p1.id, pagg_tab_m_p1.a
         Filter: (sum(pagg_tab_m_p1.b) < 50)
         ->  Append
               ->  RemoteScan on pagg_tab_m_p1
                     Shard: 3    Remote SQL: select a, ((a + b) DIV 2), b, c from regression_$$_public.pagg_tab_m_p1 
               ->  RemoteScan on pagg_tab_m_p2
                     Shard: 4    Remote SQL: select a, ((a + b) DIV 2), b, c from regression_$$_public.pagg_tab_m_p2 
               ->  RemoteScan on pagg_tab_m_p3
                     Shard: 3    Remote SQL: select a, ((a + b) DIV 2), b, c from regression_$$_public.pagg_tab_m_p3 
(12 rows)

SELECT a, sum(b), avg(c), count(*) FROM pagg_tab_m GROUP BY a, (a+b)/2 HAVING sum(b) < 50 ORDER BY 1, 2, 3;
 a  | sum |         avg         | count 
----+-----+---------------------+-------
  0 |   0 | 20.0000000000000000 |    25
  1 |  25 | 21.0000000000000000 |    25
 10 |   0 | 20.0000000000000000 |    25
 11 |  25 | 21.0000000000000000 |    25
 20 |   0 | 20.0000000000000000 |    25
 21 |  25 | 21.0000000000000000 |    25
(6 rows)

drop table if exists pagg_tab_m;
-- bug 53
drop table if exists trunc_stats_test1;
NOTICE:  table "trunc_stats_test1" does not exist, skipping
CREATE TABLE trunc_stats_test1(id serial primary key, stuff text);
insert into trunc_stats_test1 (stuff) values('abc'), ('xyz');
select*from trunc_stats_test1;
 id | stuff 
----+-------
  1 | abc
  2 | xyz
(2 rows)

UPDATE trunc_stats_test1 SET id = id + 10 WHERE id IN (1, 2);
select*from trunc_stats_test1;
 id | stuff 
----+-------
 11 | abc
 12 | xyz
(2 rows)

drop table if exists itest1;
NOTICE:  table "itest1" does not exist, skipping
CREATE TABLE itest1 (a int generated by default as identity primary key, b text);
INSERT INTO itest1 DEFAULT VALUES;
insert into itest1 values(DEFAULT, 'bbb');
INSERT INTO itest1 VALUES (2, 'b');
ERROR:  Kunlun-db: MySQL storage node (3, 7) returned error: 1062, Duplicate entry '2' for key 'PRIMARY'.
INSERT INTO itest1 VALUES (10, 'xyz');
UPDATE itest1 SET a = DEFAULT WHERE a = 2;
select*from itest1;
 a  |  b  
----+-----
  1 | 
  3 | bbb
 10 | xyz
(3 rows)

alter table itest1 add column c int default 3;
UPDATE itest1 SET c = DEFAULT WHERE a = 2;
select*from itest1;
 a  |  b  | c 
----+-----+---
  1 |     | 3
  3 | bbb | 3
 10 | xyz | 3
(3 rows)

insert into itest1(b,c) values('aaa', 44);
select*from itest1;
 a  |  b  | c  
----+-----+----
  1 |     |  3
  3 | bbb |  3
  4 | aaa | 44
 10 | xyz |  3
(4 rows)

UPDATE itest1 SET c = DEFAULT WHERE a = 2;
select*from itest1;
 a  |  b  | c  
----+-----+----
  1 |     |  3
  3 | bbb |  3
  4 | aaa | 44
 10 | xyz |  3
(4 rows)

insert into itest1(b,c) values('aaa', 44);
select*from itest1;
 a  |  b  | c  
----+-----+----
  1 |     |  3
  3 | bbb |  3
  4 | aaa | 44
  5 | aaa | 44
 10 | xyz |  3
(5 rows)

UPDATE itest1 SET c = DEFAULT WHERE a = 3;
select*from itest1;
 a  |  b  | c  
----+-----+----
  1 |     |  3
  3 | bbb |  3
  4 | aaa | 44
  5 | aaa | 44
 10 | xyz |  3
(5 rows)

UPDATE itest1 SET a = DEFAULT WHERE a = 3;
select*from itest1;
 a  |  b  | c  
----+-----+----
  1 |     |  3
  4 | aaa | 44
  5 | aaa | 44
  6 | bbb |  3
 10 | xyz |  3
(5 rows)

insert into itest1 values(DEFAULT, 'xxx', 333), (DEFAULT, 'yyy', 444);
select*from itest1;
 a  |  b  |  c  
----+-----+-----
  1 |     |   3
  4 | aaa |  44
  5 | aaa |  44
  6 | bbb |   3
  7 | xxx | 333
  8 | yyy | 444
 10 | xyz |   3
(7 rows)

-- bug 28
CREATE TABLE base_tbl (a int PRIMARY KEY, b varchar(50) DEFAULT 'Unspecified');
INSERT INTO base_tbl SELECT i, 'Row ' i FROM generate_series(-2, 2) g(i);
CREATE VIEW rw_view1 AS SELECT * FROM base_tbl WHERE a>0;
EXPLAIN (costs off) UPDATE rw_view1 SET a=6 WHERE a=5;
                 QUERY PLAN                 
--------------------------------------------
 Update on base_tbl
   ->  RemoteScan on base_tbl
         Filter: ((a > 0) AND (a = 5))
         Shard: 4        Remote SQL: (null)
(4 rows)

EXPLAIN (costs off) DELETE FROM rw_view1 WHERE a=5;
                 QUERY PLAN                 
--------------------------------------------
 Delete on base_tbl
   ->  RemoteScan on base_tbl
         Filter: ((a > 0) AND (a = 5))
         Shard: 4        Remote SQL: (null)
(4 rows)

DROP table if exists T;
NOTICE:  table "t" does not exist, skipping
CREATE TABLE T (pk INT NOT NULL PRIMARY KEY);
INSERT INTO T SELECT * FROM generate_series(1, 10) a;
EXPLAIN (VERBOSE TRUE, COSTS FALSE) DELETE FROM T WHERE pk BETWEEN 10 AND 20 RETURNING *;
                   QUERY PLAN                    
-------------------------------------------------
 Delete on public.t
   Output: pk
   ->  RemoteScan on public.t
         Output: ctid
         Filter: ((t.pk >= 10) AND (t.pk <= 20))
         Shard: 3        Remote SQL: (null)
(6 rows)

drop table if exists mvtest_t;
NOTICE:  table "mvtest_t" does not exist, skipping
CREATE TABLE mvtest_t (id int NOT NULL PRIMARY KEY, type varchar(50) NOT NULL, amt numeric NOT NULL);
EXPLAIN (costs off)
	CREATE MATERIALIZED VIEW mvtest_tm AS SELECT type, sum(amt) AS totamt FROM mvtest_t GROUP BY type WITH NO DATA;
                                          QUERY PLAN                                          
----------------------------------------------------------------------------------------------
 HashAggregate
   Group Key: type
   ->  RemoteScan on mvtest_t
         Shard: 4        Remote SQL: select id, type, amt from regression_$$_public.mvtest_t 
(4 rows)

-- bug 36
create table parted_conflict (a int primary key, b text) partition by range (a);
create table parted_conflict_1 partition of parted_conflict for values from (0) to (1000) partition by range (a);
create table parted_conflict_1_1 partition of parted_conflict_1 for values from (0) to (500);
insert into parted_conflict values (40, 'forty'), (30, 'thirty');
alter table parted_conflict add column c int default 3;
select*from parted_conflict;
 a  |   b    | c 
----+--------+---
 30 | thirty | 3
 40 | forty  | 3
(2 rows)

delete from parted_conflict where a = 30;
update parted_conflict set c=c+10 where a=40;
select*from parted_conflict;
 a  |   b   | c  
----+-------+----
 40 | forty | 13
(1 row)

drop table parted_conflict;
-- bug 43 
drop table int4_tbl cascade;
ERROR:  table "int4_tbl" does not exist
drop table int8_tbl cascade;
ERROR:  table "int8_tbl" does not exist
drop table text_tbl cascade;
ERROR:  table "text_tbl" does not exist
CREATE TABLE INT4_TBL(id serial primary key, f1 int4);
CREATE TABLE INT8_TBL(id serial primary key, q1 int8, q2 int8);
CREATE TABLE TEXT_TBL (id serial primary key, f1 text);
insert into int4_tbl(f1) values(1),(2),(3),(4);
insert into int8_tbl(q1, q2) values(1,2),(2,3),(3,4),(4,5);
insert into text_tbl values('abc'),('bcd'),('def');
ERROR:  invalid input syntax for integer: "abc"
LINE 1: insert into text_tbl values('abc'),('bcd'),('def');
                                    ^
explain (verbose, costs off)
select * from
    text_tbl t1
    left join int8_tbl i8
    on i8.q2 = 123,
    lateral (select i8.q1, t2.f1 from text_tbl t2 limit 1) as ss1,
    lateral (select ss1.* from text_tbl t3 limit 1) as ss2
where t1.f1 = ss2.f1;
                                                     QUERY PLAN                                                     
--------------------------------------------------------------------------------------------------------------------
 Nested Loop
   Output: t1.id, t1.f1, i8.id, i8.q1, i8.q2, (i8.q1), t2.id, ((i8.q1)), (t2.id)
   Join Filter: (t1.f1 = (t2.id))
   ->  Nested Loop
         Output: t1.id, t1.f1, i8.id, i8.q1, i8.q2, (i8.q1), t2.id
         ->  Nested Loop Left Join
               Output: t1.id, t1.f1, i8.id, i8.q1, i8.q2
               ->  Materialize
                     Output: t1.id, t1.f1
                     ->  RemoteScan on public.text_tbl t1
                           Output: t1.id, t1.f1
                           Shard: 4      Remote SQL: select id, f1 from regression_$$_public.text_tbl 
               ->  RemoteScan on public.int8_tbl i8
                     Output: i8.id, i8.q1, i8.q2
                     Filter: (i8.q2 = 123)
                     Shard: 3    Remote SQL: select id, q1, q2 from regression_$$_public.int8_tbl  where (q2 = 123)
         ->  Materialize
               Output: (i8.q1), t2.id
               ->  Limit
                     Output: (i8.q1), t2.id
                     ->  RemoteScan on public.text_tbl t2
                           Output: i8.q1, t2.id
                           Shard: 4      Remote SQL: select f1 from regression_$$_public.text_tbl 
   ->  Materialize
         Output: ((i8.q1)), (t2.id)
         ->  Limit
               Output: ((i8.q1)), (t2.id)
               ->  RemoteScan on public.text_tbl t3
                     Output: (i8.q1), t2.id
                     Shard: 4    Remote SQL: select f1 from regression_$$_public.text_tbl 
(30 rows)

-- AND no explain--
select * from
    text_tbl t1
    left join int8_tbl i8
    on i8.q2 = 123,
    lateral (select i8.q1, t2.f1 from text_tbl t2 limit 1) as ss1,
    lateral (select ss1.* from text_tbl t3 limit 1) as ss2
where t1.f1 = ss2.f1;
 id | f1 | id | q1 | q2 | q1 | f1 | q1 | f1 
----+----+----+----+----+----+----+----+----
(0 rows)

-- AND --
select * from
    text_tbl t1
    left join int8_tbl i8
    on i8.q2 = 123,
    lateral (select i8.q1, t2.f1 from text_tbl t2 limit 1) as ss1,
    lateral (select ss1.* from text_tbl t3 limit 1) as ss2
where t1.f1 = ss2.f1;
 id | f1 | id | q1 | q2 | q1 | f1 | q1 | f1 
----+----+----+----+----+----+----+----+----
(0 rows)

-- AND --
select ss2.* from
    int4_tbl i41
    left join int8_tbl i8
        join (select i42.f1 as c1, i43.f1 as c2, 42 as c3
            from int4_tbl i42, int4_tbl i43) ss1
        on i8.q1 = ss1.c2
    on i41.f1 = ss1.c1,
    lateral (select i41.*, i8.*, ss1.* from text_tbl limit 1) ss2
where ss1.c2 = 0;
 id | f1 | id | q1 | q2 | c1 | c2 | c3 
----+----+----+----+----+----+----+----
(0 rows)

-----------------------------
drop table if exists rngfunc2 cascade;
NOTICE:  table "rngfunc2" does not exist, skipping
CREATE TABLE rngfunc2(id serial primary key, rngfuncid int, f2 int);
INSERT INTO rngfunc2(rngfuncid, f2) VALUES(1, 11);
INSERT INTO rngfunc2(rngfuncid, f2) VALUES(2, 22);
INSERT INTO rngfunc2(rngfuncid, f2) VALUES(1, 111);
drop function if exists rngfunct;
NOTICE:  function rngfunct() does not exist, skipping
CREATE FUNCTION rngfunct(int) returns setof rngfunc2 as 'SELECT * FROM rngfunc2 WHERE rngfuncid = $1 ORDER BY f2;' LANGUAGE SQL;
select * from rngfunc2, rngfunct(rngfunc2.rngfuncid) z where rngfunc2.f2 = z.f2;
 id | rngfuncid | f2  | id | rngfuncid | f2  
----+-----------+-----+----+-----------+-----
  1 |         1 |  11 |  1 |         1 |  11
  2 |         2 |  22 |  2 |         2 |  22
  3 |         1 | 111 |  3 |         1 | 111
(3 rows)

select * from rngfunc2, rngfunct(rngfunc2.rngfuncid) with ordinality as z(rngfuncid,f2,ord) where rngfunc2.f2 = z.f2;
 id | rngfuncid | f2 | rngfuncid | f2 | ord | ordinality 
----+-----------+----+-----------+----+-----+------------
(0 rows)

select * from rngfunc2 where f2 in (select f2 from rngfunct(rngfunc2.rngfuncid) z where z.rngfuncid = rngfunc2.rngfuncid) ORDER BY 1,2;
 id | rngfuncid | f2  
----+-----------+-----
  1 |         1 |  11
  2 |         2 |  22
  3 |         1 | 111
(3 rows)

select * from rngfunc2 where f2 in (select f2 from rngfunct(1) z where z.rngfuncid = rngfunc2.rngfuncid) ORDER BY 1,2;
 id | rngfuncid | f2  
----+-----------+-----
  1 |         1 |  11
  3 |         1 | 111
(2 rows)

select * from rngfunc2 where f2 in (select f2 from rngfunct(rngfunc2.rngfuncid) z where z.rngfuncid = 1) ORDER BY 1,2;
 id | rngfuncid | f2  
----+-----------+-----
  1 |         1 |  11
  3 |         1 | 111
(2 rows)

DROP TABLE if exists prt1_l cascade;
NOTICE:  table "prt1_l" does not exist, skipping
CREATE TABLE prt1_l (a int , b int, c varchar, primary key(a,c,b)) PARTITION BY RANGE(a);
CREATE TABLE prt1_l_p1 PARTITION OF prt1_l FOR VALUES FROM (0) TO (250);
CREATE TABLE prt1_l_p2 PARTITION OF prt1_l FOR VALUES FROM (250) TO (500) PARTITION BY LIST (c);
CREATE TABLE prt1_l_p2_p1 PARTITION OF prt1_l_p2 FOR VALUES IN ('0000', '0001');
CREATE TABLE prt1_l_p2_p2 PARTITION OF prt1_l_p2 FOR VALUES IN ('0002', '0003');
CREATE TABLE prt1_l_p3 PARTITION OF prt1_l FOR VALUES FROM (500) TO (600) PARTITION BY RANGE (b);
CREATE TABLE prt1_l_p3_p1 PARTITION OF prt1_l_p3 FOR VALUES FROM (0) TO (13);
CREATE TABLE prt1_l_p3_p2 PARTITION OF prt1_l_p3 FOR VALUES FROM (13) TO (25);
INSERT INTO prt1_l SELECT i, i % 25, to_char(i % 4, 'FM0000') FROM generate_series(0, 599, 2) i;
DROP TABLE if exists prt2_l;
NOTICE:  table "prt2_l" does not exist, skipping
CREATE TABLE prt2_l (a int, b int , c varchar, primary key(b,c,a)) PARTITION BY RANGE(b);
CREATE TABLE prt2_l_p1 PARTITION OF prt2_l FOR VALUES FROM (0) TO (250);
CREATE TABLE prt2_l_p2 PARTITION OF prt2_l FOR VALUES FROM (250) TO (500) PARTITION BY LIST (c);
CREATE TABLE prt2_l_p2_p1 PARTITION OF prt2_l_p2 FOR VALUES IN ('0000', '0001');
CREATE TABLE prt2_l_p2_p2 PARTITION OF prt2_l_p2 FOR VALUES IN ('0002', '0003');
CREATE TABLE prt2_l_p3 PARTITION OF prt2_l FOR VALUES FROM (500) TO (600) PARTITION BY RANGE (a);
CREATE TABLE prt2_l_p3_p1 PARTITION OF prt2_l_p3 FOR VALUES FROM (0) TO (13);
CREATE TABLE prt2_l_p3_p2 PARTITION OF prt2_l_p3 FOR VALUES FROM (13) TO (25);
INSERT INTO prt2_l SELECT i % 25, i, to_char(i % 4, 'FM0000') FROM generate_series(0, 599, 3) i;
SELECT * FROM prt1_l t1 LEFT JOIN LATERAL (SELECT t2.a AS t2a, t2.c AS t2c, t2.b AS t2b, t3.b AS t3b, least(t1.a,t2.a,t3.b) FROM prt1_l t2 JOIN prt2_l t3 ON (t2.a = t3.b AND t2.c = t3.c)) ss ON t1.a = ss.t2a AND t1.c = ss.t2c WHERE t1.b = 0 ORDER BY t1.a;
  a  | b |  c   | t2a | t2c  | t2b | t3b | least 
-----+---+------+-----+------+-----+-----+-------
   0 | 0 | 0000 |   0 | 0000 |   0 |   0 |     0
  50 | 0 | 0002 |     |      |     |     |      
 100 | 0 | 0000 |     |      |     |     |      
 150 | 0 | 0002 | 150 | 0002 |   0 | 150 |   150
 200 | 0 | 0000 |     |      |     |     |      
 250 | 0 | 0002 |     |      |     |     |      
 300 | 0 | 0000 | 300 | 0000 |   0 | 300 |   300
 350 | 0 | 0002 |     |      |     |     |      
 400 | 0 | 0000 |     |      |     |     |      
 450 | 0 | 0002 | 450 | 0002 |   0 | 450 |   450
 500 | 0 | 0000 |     |      |     |     |      
 550 | 0 | 0002 |     |      |     |     |      
(12 rows)

-- bug 66 
DROP TABLE if exists prt1;
NOTICE:  table "prt1" does not exist, skipping
DROP TABLE if exists prt2;
NOTICE:  table "prt2" does not exist, skipping
CREATE TABLE prt1 (a int primary key, b int, c varchar) PARTITION BY RANGE(a);
CREATE TABLE prt1_p1 PARTITION OF prt1 FOR VALUES FROM (0) TO (250);
CREATE TABLE prt1_p3 PARTITION OF prt1 FOR VALUES FROM (500) TO (600);
CREATE TABLE prt1_p2 PARTITION OF prt1 FOR VALUES FROM (250) TO (500);
INSERT INTO prt1 SELECT i, i % 25, to_char(i, 'FM0000') FROM generate_series(0, 599) i WHERE i % 2 = 0;
CREATE TABLE prt2 (a int, b int primary key, c varchar) PARTITION BY RANGE(b);
CREATE TABLE prt2_p1 PARTITION OF prt2 FOR VALUES FROM (0) TO (250);
CREATE TABLE prt2_p2 PARTITION OF prt2 FOR VALUES FROM (250) TO (500);
CREATE TABLE prt2_p3 PARTITION OF prt2 FOR VALUES FROM (500) TO (600);
INSERT INTO prt2 SELECT i % 25, i, to_char(i, 'FM0000') FROM generate_series(0, 599) i WHERE i % 3 = 0;
SELECT t1, t2 FROM prt1 t1 LEFT JOIN prt2 t2 ON t1.a = t2.b WHERE t1.b = 0 ORDER BY t1.a, t2.b;
      t1      |      t2      
--------------+--------------
 (0,0,0000)   | (0,0,0000)
 (50,0,0050)  | 
 (100,0,0100) | 
 (150,0,0150) | (0,150,0150)
 (200,0,0200) | 
 (250,0,0250) | 
 (300,0,0300) | (0,300,0300)
 (350,0,0350) | 
 (400,0,0400) | 
 (450,0,0450) | (0,450,0450)
 (500,0,0500) | 
 (550,0,0550) | 
(12 rows)

SELECT t1.a, t2.b FROM prt1 t1, prt2 t2 WHERE t1::text = t2::text AND t1.a = t2.b ORDER BY t1.a;
ERROR:  Kunlun-db: Must specify whole-row target left-most.
SELECT * FROM prt1 t1 LEFT JOIN  (SELECT t2.a AS t2a, t3.a AS t3a, least(t2.a,t3.b) FROM prt1 t2 JOIN prt2 t3 ON (t2.a = t3.b)) ss ON t1.a = ss.t2a WHERE t1.b = 0 ORDER BY t1.a;
  a  | b |  c   | t2a | t3a | least 
-----+---+------+-----+-----+-------
   0 | 0 | 0000 |   0 |   0 |     0
  50 | 0 | 0050 |     |     |      
 100 | 0 | 0100 |     |     |      
 150 | 0 | 0150 | 150 |   0 |   150
 200 | 0 | 0200 |     |     |      
 250 | 0 | 0250 |     |     |      
 300 | 0 | 0300 | 300 |   0 |   300
 350 | 0 | 0350 |     |     |      
 400 | 0 | 0400 |     |     |      
 450 | 0 | 0450 | 450 |   0 |   450
 500 | 0 | 0500 |     |     |      
 550 | 0 | 0550 |     |     |      
(12 rows)

SELECT * FROM prt1 t1 LEFT JOIN LATERAL (SELECT t2.a AS t2a, t3.a AS t3a, least(t1.a,t2.a,t3.b) FROM prt1 t2 JOIN prt2 t3 ON (t2.a = t3.b)) ss ON t1.a = ss.t2a WHERE t1.b = 0 ORDER BY t1.a;
  a  | b |  c   | t2a | t3a | least 
-----+---+------+-----+-----+-------
   0 | 0 | 0000 |   0 |   0 |     0
  50 | 0 | 0050 |     |     |      
 100 | 0 | 0100 |     |     |      
 150 | 0 | 0150 | 150 |   0 |   150
 200 | 0 | 0200 |     |     |      
 250 | 0 | 0250 |     |     |      
 300 | 0 | 0300 | 300 |   0 |   300
 350 | 0 | 0350 |     |     |      
 400 | 0 | 0400 |     |     |      
 450 | 0 | 0450 | 450 |   0 |   450
 500 | 0 | 0500 |     |     |      
 550 | 0 | 0550 |     |     |      
(12 rows)

-- bug 67
SET enable_partitionwise_join to true;
DROP TABLE if exists prt1_l;
CREATE TABLE prt1_l (a int, b int, c varchar, primary key(a,b,c)) PARTITION BY RANGE(a);
CREATE TABLE prt1_l_p1 PARTITION OF prt1_l FOR VALUES FROM (0) TO (250);
CREATE TABLE prt1_l_p2 PARTITION OF prt1_l FOR VALUES FROM (250) TO (500) PARTITION BY LIST (c);
CREATE TABLE prt1_l_p2_p1 PARTITION OF prt1_l_p2 FOR VALUES IN ('0000', '0001');
CREATE TABLE prt1_l_p2_p2 PARTITION OF prt1_l_p2 FOR VALUES IN ('0002', '0003');
CREATE TABLE prt1_l_p3 PARTITION OF prt1_l FOR VALUES FROM (500) TO (600) PARTITION BY RANGE (b);
CREATE TABLE prt1_l_p3_p1 PARTITION OF prt1_l_p3 FOR VALUES FROM (0) TO (13);
CREATE TABLE prt1_l_p3_p2 PARTITION OF prt1_l_p3 FOR VALUES FROM (13) TO (25);
INSERT INTO prt1_l SELECT i, i % 25, to_char(i % 4, 'FM0000') FROM generate_series(0, 599, 2) i;
DROP TABLE if exists prt2_l;
CREATE TABLE prt2_l (a int, b int, c varchar, primary key(a,b,c)) PARTITION BY RANGE(b);
CREATE TABLE prt2_l_p1 PARTITION OF prt2_l FOR VALUES FROM (0) TO (250);
CREATE TABLE prt2_l_p2 PARTITION OF prt2_l FOR VALUES FROM (250) TO (500) PARTITION BY LIST (c);
CREATE TABLE prt2_l_p2_p1 PARTITION OF prt2_l_p2 FOR VALUES IN ('0000', '0001');
CREATE TABLE prt2_l_p2_p2 PARTITION OF prt2_l_p2 FOR VALUES IN ('0002', '0003');
CREATE TABLE prt2_l_p3 PARTITION OF prt2_l FOR VALUES FROM (500) TO (600) PARTITION BY RANGE (a);
CREATE TABLE prt2_l_p3_p1 PARTITION OF prt2_l_p3 FOR VALUES FROM (0) TO (13);
CREATE TABLE prt2_l_p3_p2 PARTITION OF prt2_l_p3 FOR VALUES FROM (13) TO (25);
INSERT INTO prt2_l SELECT i % 25, i, to_char(i % 4, 'FM0000') FROM generate_series(0, 599, 3) i;
EXPLAIN (COSTS OFF) SELECT t1.a, t1.c, t2.b, t2.c FROM prt1_l t1, prt2_l t2 WHERE t1.a = t2.b AND t1.b = 0 ORDER BY t1.a, t2.b;
                                                          QUERY PLAN                                                           
-------------------------------------------------------------------------------------------------------------------------------
 Sort
   Sort Key: t1.a
   ->  Append
         ->  Nested Loop
               Join Filter: (t1.a = t2.a)
               ->  RemoteScan on prt1_l_p1 t1
                     Filter: (b = 0)
                     Shard: 4    Remote SQL: select a, c from regression_$$_public.prt1_l_p1  where (b = 0)
               ->  RemoteScan on prt2_l_p1 t2
                     Shard: 3    Remote SQL: select b, c from regression_$$_public.prt2_l_p1 
         ->  Hash Join
               Hash Cond: (t1_1.a = t2_1.a)
               ->  Append
                     ->  Materialize
                           ->  RemoteScan on prt1_l_p2_p1 t1_1
                                 Filter: (b = 0)
                                 Shard: 3        Remote SQL: select a, c from regression_$$_public.prt1_l_p2_p1  where (b = 0)
                     ->  RemoteScan on prt1_l_p2_p2 t1_2
                           Filter: (b = 0)
                           Shard: 4      Remote SQL: select a, c from regression_$$_public.prt1_l_p2_p2  where (b = 0)
               ->  Hash
                     ->  Append
                           ->  RemoteScan on prt2_l_p2_p1 t2_1
                                 Shard: 4        Remote SQL: select b, c from regression_$$_public.prt2_l_p2_p1 
                           ->  RemoteScan on prt2_l_p2_p2 t2_2
                                 Shard: 3        Remote SQL: select b, c from regression_$$_public.prt2_l_p2_p2 
         ->  Nested Loop
               Join Filter: (t1_3.a = t2_3.a)
               ->  Append
                     ->  Materialize
                           ->  RemoteScan on prt1_l_p3_p1 t1_3
                                 Filter: (b = 0)
                                 Shard: 3        Remote SQL: select a, c from regression_$$_public.prt1_l_p3_p1  where (b = 0)
               ->  Materialize
                     ->  Append
                           ->  RemoteScan on prt2_l_p3_p1 t2_3
                                 Shard: 4        Remote SQL: select b, c from regression_$$_public.prt2_l_p3_p1 
                           ->  RemoteScan on prt2_l_p3_p2 t2_4
                                 Shard: 3        Remote SQL: select b, c from regression_$$_public.prt2_l_p3_p2 
(39 rows)

SELECT t1.a, t1.c, t2.b, t2.c FROM prt1_l t1, prt2_l t2 WHERE t1.a = t2.b AND t1.b = 0 ORDER BY t1.a, t2.b;
  a  |  c   |  b  |  c   
-----+------+-----+------
   0 | 0000 |   0 | 0000
 150 | 0002 | 150 | 0002
 350 | 0002 | 350 | 0002
 450 | 0002 | 450 | 0002
 450 | 0002 | 450 | 0002
(5 rows)

-- bug 16
create table insertconflicttest1(key1 int4, fruit text);
create index idx1 on insertconflicttest1(fruit);
-- bug 40 
drop table SUBSELECT_TBL cascade;
ERROR:  table "subselect_tbl" does not exist
CREATE TABLE SUBSELECT_TBL ( id serial primary key, f1 integer, f2 integer, f3 float );
INSERT INTO SUBSELECT_TBL (f1, f2, f3) VALUES (1, 2, 3), (2, 3, 4), (3, 4, 5), (1, 1, 1), (2, 2, 2), (3, 3, 3), (6, 7, 8), (8, 9, NULL);
SELECT f1 AS "Correlated Field", f3 AS "Second Field" FROM SUBSELECT_TBL upper WHERE f3 IN (SELECT upper.f1 + f2 FROM SUBSELECT_TBL WHERE f2 = CAST(f3 AS integer));
 Correlated Field | Second Field 
------------------+--------------
                1 |            3
                2 |            4
                3 |            5
                6 |            8
(4 rows)

-- bug 33
begin;
savepoint sa;
release savepoint sa;
commit;
-- bug 42
drop table if exists tenk1;
NOTICE:  table "tenk1" does not exist, skipping
drop table if exists INT4_TBL;
drop table if exists FLOAT8_TBL;
NOTICE:  table "float8_tbl" does not exist, skipping
 CREATE TABLE tenk1 (
    unique1 int4,
    unique2 int4,
    two int4,
    four int4,
    ten int4,
    twenty int4,
    hundred int4,
    thousand int4,
    twothousand int4,
    fivethous int4,
    tenthous int4,
    odd int4,
    even int4,
    stringu1 name,
    stringu2 name,
    string4 name
);
CREATE TABLE INT4_TBL(f1 int4);
CREATE TABLE FLOAT8_TBL(f1 float8);
begin;
select count(*) from tenk1 x where x.unique1 in (select a.f1 from int4_tbl a,float8_tbl b where a.f1=b.f1) and
    x.unique1 = 0 and x.unique1 in (select aa.f1 from int4_tbl aa,float8_tbl bb where aa.f1=bb.f1);
 count 
-------
     0
(1 row)

rollback;
-- bug 81
drop table if exists INT8_TBL;
CREATE TABLE INT8_TBL(id serial primary key, q1 int8, q2 int8);
INSERT INTO INT8_TBL(q1, q2)  VALUES(' 123 ',' 456');
INSERT INTO INT8_TBL(q1, q2)  VALUES('123 ','4567890123456789');
INSERT INTO INT8_TBL(q1, q2)  VALUES('4567890123456789','123');
INSERT INTO INT8_TBL(q1, q2)  VALUES(+4567890123456789,'4567890123456789');
INSERT INTO INT8_TBL(q1, q2)  VALUES('+4567890123456789','-4567890123456789');
select t1.q2, count(t2.*) from int8_tbl t1 left join (select * from int8_tbl) t2 on (t1.q2 = t2.q1) group by t1.q2 order by 1;
        q2         | count 
-------------------+-------
 -4567890123456789 |     0
               123 |     2
               456 |     0
  4567890123456789 |     6
(4 rows)

select t1.q2, count(t2.*) from int8_tbl t1 left join (select q1, case when q2=1 then 1 else q2 end as q2 from int8_tbl) t2 on (t1.q2 = t2.q1) group by t1.q2 order by 1;
        q2         | count 
-------------------+-------
 -4567890123456789 |     0
               123 |     2
               456 |     0
  4567890123456789 |     6
(4 rows)

drop table if exists INT8_TBL;
CREATE TABLE INT8_TBL(id serial primary key, q1 int8, q2 int8);
INSERT INTO INT8_TBL(q1, q2) VALUES(' 123 ',' 456');
INSERT INTO INT8_TBL(q1, q2)  VALUES('123 ','4567890123456789');
INSERT INTO INT8_TBL(q1, q2)  VALUES('4567890123456789','123');
INSERT INTO INT8_TBL(q1, q2)  VALUES(+4567890123456789,'4567890123456789');
INSERT INTO INT8_TBL(q1, q2)  VALUES('+4567890123456789','-4567890123456789');
select t1.q2, count(t2.*) from int8_tbl t1 left join int8_tbl t2 on (t1.q2 = t2.q1) group by t1.q2 order by 1;
        q2         | count 
-------------------+-------
 -4567890123456789 |     0
               123 |     2
               456 |     0
  4567890123456789 |     6
(4 rows)

-- bug 71
DROP table if exists T;
CREATE TABLE T(pk INT NOT NULL PRIMARY KEY);
INSERT INTO T VALUES (1);
ALTER TABLE T ADD COLUMN c1 TIMESTAMP DEFAULT now();
select*from T;
 pk |            c1            
----+--------------------------
  1 | Wed Jul 21 12:11:58 2021
(1 row)

insert into T values(2);
select*from T;
 pk |            c1            
----+--------------------------
  1 | Wed Jul 21 12:11:58 2021
  2 | Tue Jul 20 21:11:59 2021
(2 rows)

 CREATE OR REPLACE FUNCTION foo(a INT) RETURNS TEXT AS $$
DECLARE res TEXT = 'xyz';

    i INT;

BEGIN

    i = 0;
    WHILE (i < a) LOOP

        res = res || chr(ascii('a') + i);

        i = i + 1;

    END LOOP;
    RETURN res;

END; $$ LANGUAGE PLPGSQL STABLE;
DROP table if exists T;
CREATE TABLE T(pk INT NOT NULL PRIMARY KEY, c_int INT DEFAULT LENGTH(foo(6)));
INSERT INTO T VALUES (1), (2);
select*from t;
 pk | c_int 
----+-------
  1 |     9
  2 |     9
(2 rows)

ALTER TABLE T ADD COLUMN c_bpchar BPCHAR(50) DEFAULT foo(4), ALTER COLUMN c_int SET DEFAULT LENGTH(foo(8));
ERROR:  Kunlun-db: MySQL storage node (4, 8) returned error: 1064, You have an error in your SQL syntax; check the manual that corresponds to your MySQL server version for the right syntax to use near 'foo(4)' at line 1.
select*from t;
 pk | c_int 
----+-------
  1 |     9
  2 |     9
(2 rows)

-- bug 21
drop table if exists mlparted;
NOTICE:  table "mlparted" does not exist, skipping
drop table if exists mlparted1;
NOTICE:  table "mlparted1" does not exist, skipping
create table mlparted(id integer primary key);
create table mlparted1(id integer primary key);
select attrelid::regclass, attname, attnum from pg_attribute where attname = 'a' and (attrelid = 'mlparted'::regclass or attrelid = 'mlparted1'::regclass);
 attrelid | attname | attnum 
----------+---------+--------
(0 rows)

insert into mlparted values(1),(2),(3),(4);
insert into mlparted1 values(5),(2),(3),(4);
select attrelid::regclass, attname, attnum from pg_attribute where attname = 'a' and (attrelid = 'mlparted'::regclass or attrelid = 'mlparted1'::regclass);
 attrelid | attname | attnum 
----------+---------+--------
(0 rows)

-- bug 32
drop table if exists test_missing_target;
NOTICE:  table "test_missing_target" does not exist, skipping
CREATE TABLE test_missing_target (a int primary key, b int, c char(8), d char);
INSERT INTO test_missing_target VALUES (0, 1, 'XXXX', 'A'), (1, 2, 'ABAB', 'b'), (2, 2, 'ABAB', 'c'), (3, 3, 'BBBB', 'D'), (4, 3, 'BBBB', 'e'), (5, 3, 'bbbb', 'F'), (6, 4, 'cccc', 'g'), (7, 4, 'cccc', 'h'), (8, 4, 'CCCC', 'I'), (9, 4, 'CCCC', 'j');
SELECT x.b, count(*) FROM test_missing_target x, test_missing_target y WHERE x.a = y.a GROUP BY x.b ORDER BY x.b;
 b | count 
---+-------
 1 |     1
 2 |     2
 3 |     3
 4 |     4
(4 rows)

SELECT count(*) FROM test_missing_target x, test_missing_target y WHERE x.a = y.a GROUP BY x.b ORDER BY x.b;
 count 
-------
     1
     2
     3
     4
(4 rows)

SELECT x.b/2, count(x.b) FROM test_missing_target x, test_missing_target y WHERE x.a = y.a GROUP BY x.b/2 ORDER BY x.b/2;
 ?column? | count 
----------+-------
        0 |     1
        1 |     5
        2 |     4
(3 rows)

-- bug 64
drop table if exists itest7;
NOTICE:  table "itest7" does not exist, skipping
CREATE TABLE itest7 (id int primary key, a int GENERATED ALWAYS AS IDENTITY);
insert into itest7 (id) values(1),(2),(3);
insert into itest7 values(4, 40),(5, 50);
ERROR:  cannot insert into column "a"
DETAIL:  Column "a" is an identity column defined as GENERATED ALWAYS.
HINT:  Use OVERRIDING SYSTEM VALUE to override.
select*from itest7;
 id | a 
----+---
  1 | 1
  2 | 2
  3 | 3
(3 rows)

ALTER TABLE itest7 ALTER COLUMN a SET GENERATED BY DEFAULT;
insert into itest7 values(6, 60),(7, 70);
select*from itest7;
 id | a  
----+----
  1 |  1
  2 |  2
  3 |  3
  6 | 60
  7 | 70
(5 rows)

-- bug 65
drop table if exists itest13;
NOTICE:  table "itest13" does not exist, skipping
CREATE TABLE itest13 (a int primary key);
ALTER TABLE itest13 ADD COLUMN b int GENERATED BY DEFAULT AS IDENTITY;
INSERT INTO itest13 VALUES (1), (2), (3);
SELECT * FROM itest13;
 a | b 
---+---
 1 | 1
 2 | 2
 3 | 3
(3 rows)

ALTER TABLE itest13 ADD COLUMN c int GENERATED BY DEFAULT AS IDENTITY;
SELECT * FROM itest13;
 a | b | c 
---+---+---
 1 | 1 | 0
 2 | 2 | 0
 3 | 3 | 0
(3 rows)

drop table if exists itest6;
NOTICE:  table "itest6" does not exist, skipping
CREATE TABLE itest6 (a int GENERATED ALWAYS AS IDENTITY primary key, b text);
INSERT INTO itest6 DEFAULT VALUES;
ALTER TABLE itest6 ALTER COLUMN a SET GENERATED BY DEFAULT SET INCREMENT BY 2 SET START WITH 100 RESTART;
SELECT * FROM itest6;
 a | b 
---+---
 1 | 
(1 row)

INSERT INTO itest6 DEFAULT VALUES;
INSERT INTO itest6 DEFAULT VALUES;
SELECT * FROM itest6;
  a  | b 
-----+---
   1 | 
 102 | 
 104 | 
(3 rows)

-- bug 68
drop table  if exists t2;
NOTICE:  table "t2" does not exist, skipping
create table t2(a int);
create index on t2(a,a);
ERROR:  Kunlun-db: MySQL storage node (3, 7) returned error: 1060, Duplicate column name 'a'.
-- bug 83
drop table if exists revalidate_bug cascade;
NOTICE:  table "revalidate_bug" does not exist, skipping
drop function if exists inverse(int);
NOTICE:  function inverse(pg_catalog.int4) does not exist, skipping
create function inverse(int) returns float8 as
$$
begin

    return 1::float8/$1;

exception

    when division_by_zero then return 0;

end$$ language plpgsql volatile;
create table revalidate_bug (id serial primary key, c float8 unique);
insert into revalidate_bug (c) values (1);
insert into revalidate_bug (c) values (inverse(0));
select*from revalidate_bug ;
 id | c 
----+---
  2 | 0
  1 | 1
(2 rows)

-- bug 61
drop schema if exists s1 cascade;
NOTICE:  schema "s1" does not exist, skipping
create schema s1;
create table s1.t1(id int);
alter table s1.t1 set schema s1;
drop schema if exists s1 cascade;
NOTICE:  drop cascades to table s1.t1
--bug 80
drop table if exists SUBSELECT_TBL;
CREATE TABLE SUBSELECT_TBL ( id serial primary key, f1 integer, f2 integer, f3 float );
INSERT INTO SUBSELECT_TBL (f1, f2, f3) VALUES (1, 2, 3), (2, 3, 4), (3, 4, 5), (1, 1, 1), (2, 2, 2), (3, 3, 3), (6, 7, 8), (8, 9, NULL);
SELECT f1, f2 FROM SUBSELECT_TBL WHERE (f1, f2) NOT IN (SELECT f2, CAST(f3 AS int4) FROM SUBSELECT_TBL WHERE f3 IS NOT NULL);
 f1 | f2 
----+----
  1 |  2
  6 |  7
  8 |  9
(3 rows)

-- bug 33
begin;
savepoint sa;
release savepoint sa;
commit;
begin;
savepoint sa;
release savepoint sa;
rollback;
-- bug 13
SELECT SESSION_USER, CURRENT_USER;
 session_user | current_user 
--------------+--------------
 dzw          | dzw
(1 row)

drop schema if exists testschema cascade;
NOTICE:  schema "testschema" does not exist, skipping
CREATE SCHEMA if not exists testschema;
SELECT SESSION_USER, CURRENT_USER;
 session_user | current_user 
--------------+--------------
 dzw          | dzw
(1 row)

CREATE TABLE testschema.foo (i serial primary key, j serial);
insert into testschema.foo default values;
insert into testschema.foo default values;
select*from  testschema.foo;
 i | j 
---+---
 1 | 1
 2 | 2
(2 rows)

create sequence testschema.seq1;
select testschema.seq1.nextval, nextval('testschema.seq1');
 nextval | nextval 
---------+---------
       1 |       2
(1 row)

drop schema testschema cascade;
NOTICE:  drop cascades to 2 other objects
DETAIL:  drop cascades to table testschema.foo
drop cascades to sequence testschema.seq1
-- bug 44 todo
drop table if exists tenk1;
drop table if exists INT4_TBL;
 CREATE TABLE tenk1 (
 	id serial primary key,
    unique1 int4,
    unique2 int4,
    two int4,
    four int4,
    ten int4,
    twenty int4,
    hundred int4,
    thousand int4,
    twothousand int4,
    fivethous int4,
    tenthous int4,
    odd int4,
    even int4,
    stringu1 name,
    stringu2 name,
    string4 name
);
-- unique1, unique2, two, four, ten, twenty, hundred, thousand, twothousand, fivethous, tenthous, odd, even, stringu1 , stringu2 ,string4 
CREATE TABLE INT4_TBL(id serial primary key, f1 int4);
COPY tenk1(unique1, unique2, two, four, ten, twenty, hundred, thousand, twothousand, fivethous, tenthous, odd, even, stringu1 , stringu2 ,string4) FROM '/home/dzw/work/postgresql-11.5/src/test/regress/data/tenk.data';
insert into int4_tbl (f1) select generate_series(1,13);
explain (costs off)
    select b.unique1 from
        tenk1 a join tenk1 b on a.unique1 = b.unique2
        left join tenk1 c on b.unique1 = 42 and c.thousand = a.thousand
        join int4_tbl i1 on b.thousand = f1
        right join int4_tbl i2 on i2.f1 = b.tenthous
        order by 1;
ERROR:  bogus varattno for OUTER_VAR var: 3
explain (costs off)
    select b.unique1 from
        tenk1 a join tenk1 b on a.unique1 = b.unique2
        join int4_tbl i1 on b.thousand = f1
        right join int4_tbl i2 on i2.f1 = b.tenthous
        order by 1;
ERROR:  bogus varattno for OUTER_VAR var: 3
set enable_nestloop=false;
    select b.unique1 from
        tenk1 a join tenk1 b on a.unique1 = b.unique2
        left join tenk1 c on b.unique1 = 42 and c.thousand = a.thousand
        join int4_tbl i1 on b.thousand = f1
        right join int4_tbl i2 on i2.f1 = b.tenthous
        order by 1;
 unique1 
---------
       1
       2
       3
       4
       5
       6
       7
       8
       9
      10
      11
      12
      13
(13 rows)

set enable_nestloop=false;
    select b.unique1 from
        tenk1 a join tenk1 b on a.unique1 = b.unique2
        join int4_tbl i1 on b.thousand = f1
        right join int4_tbl i2 on i2.f1 = b.tenthous
        order by 1;
 unique1 
---------
       1
       2
       3
       4
       5
       6
       7
       8
       9
      10
      11
      12
      13
(13 rows)

-- below portion is fixed, above portion not yet. TODO
 drop table if exists mlparted;
drop table if exists mlparted1;
drop table if exists mlparted11;
NOTICE:  table "mlparted11" does not exist, skipping
create table mlparted (a int, b int) partition by range (a, b);
create table mlparted1 (b int not null, a int not null) partition by range ((b+0));
create table mlparted11 (like mlparted1);
alter table mlparted1 attach partition mlparted11 for values from (2) to (5);
WARNING:  Alter Table command ATTACH PARTITION not supported and skipped.
alter table mlparted attach partition mlparted1 for values from (1, 2) to (1, 10);
WARNING:  Alter Table command ATTACH PARTITION not supported and skipped.
with ins (a, b, c) as (insert into mlparted (b, a) select s.a, 1 from generate_series(2, 39) s(a) returning tableoid::regclass, *) select a, b, min(c), max(c) from ins group by a, b order by 1;
ERROR:  no partition of relation "mlparted" found for row
DETAIL:  Partition key of the failing row contains (a, b) = (1, 2).
with ins (a, b, c) as (insert into mlparted (b, a) select s.a, 1 from generate_series(2, 39) s(a) returning tableoid::regclass, *) select a, b, min(c), max(c) from ins group by a, b order by 1;
ERROR:  no partition of relation "mlparted" found for row
DETAIL:  Partition key of the failing row contains (a, b) = (1, 2).
-- bug 41
 drop table if exists INT8_TBL;
CREATE TABLE INT8_TBL(id serial primary key, q1 int8, q2 int8);
INSERT INTO INT8_TBL (q1, q2) VALUES(' 123 ',' 456');
INSERT INTO INT8_TBL (q1, q2) VALUES('123 ','4567890123456789');
INSERT INTO INT8_TBL (q1, q2) VALUES('4567890123456789','123');
INSERT INTO INT8_TBL (q1, q2) VALUES(+4567890123456789,'4567890123456789');
INSERT INTO INT8_TBL (q1, q2) VALUES('+4567890123456789','-4567890123456789');
select q1, float8(count(*)) / (select count(*) from int8_tbl) from int8_tbl group by q1 order by q1;
        q1        | ?column? 
------------------+----------
              123 |      0.4
 4567890123456789 |      0.6
(2 rows)

-- bug 78
create table b1(v box);
ERROR:  Kunlun-db: Not supported type (603).
-- bug 50 THIS BUG Is postponed
create user user1;
ERROR:  role "user1" already exists
SET SESSION AUTHORIZATION user1;
SET row_security = on;
drop table if exists r1;
NOTICE:  table "r1" does not exist, skipping
CREATE TABLE r1 (a int primary key);
INSERT INTO r1 VALUES (10), (20);
CREATE POLICY p1 ON r1 USING (false);
ERROR:  Statement 'CREATE POLICY' is not supported in Kunlun.
ALTER TABLE r1 ENABLE ROW LEVEL SECURITY;
WARNING:  Alter Table command ENABLE ROW SECURITY not supported and skipped.
ALTER TABLE r1 FORCE ROW LEVEL SECURITY;
WARNING:  Alter Table command FORCE ROW SECURITY not supported and skipped.
TABLE r1;
 a  
----
 10
 20
(2 rows)

INSERT INTO r1 VALUES (1);
UPDATE r1 SET a = 1;
ERROR:  Kunlun-db: MySQL storage node (4, 8) returned error: 1062, Duplicate entry '1' for key 'PRIMARY'.
DELETE FROM r1;
SET SESSION AUTHORIZATION dzw;
-- bug 57
drop table if exists temptest1;
NOTICE:  table "temptest1" does not exist, skipping
begin;
CREATE TEMP TABLE temptest1(col int PRIMARY KEY);
insert into temptest1 values (1),(2);
select*from temptest1;
 col 
-----
   1
   2
(2 rows)

commit;
drop table if exists temptest2;
NOTICE:  table "temptest2" does not exist, skipping
begin;
CREATE TEMP TABLE temptest2(col int PRIMARY KEY) ON COMMIT DELETE ROWS;
insert into temptest2 values (1),(2);
select*from temptest2;
 col 
-----
   1
   2
(2 rows)

commit;
-- bug 84
drop table if exists collate_test10;
NOTICE:  table "collate_test10" does not exist, skipping
 CREATE TABLE collate_test10 (
    a int primary key,
    x varchar(50) COLLATE "C",
    y varchar(50) COLLATE "POSIX"
);
INSERT INTO collate_test10 VALUES (1, 'hij', 'hij'), (2, 'HIJ', 'HIJ');
select x < y from collate_test10;
 ?column? 
----------
 f
 f
(2 rows)

drop table if exists collate_test1;
NOTICE:  table "collate_test1" does not exist, skipping
drop table if exists collate_test2;
NOTICE:  table "collate_test2" does not exist, skipping
CREATE TABLE collate_test1 (id serial primary key, a int, b varchar(50) COLLATE "C" NOT NULL);
CREATE TABLE collate_test2 (id serial primary key,  a int, b varchar(50) COLLATE "POSIX" );
INSERT INTO collate_test1 (a,b) VALUES (1, 'abc'), (2, 'Abc'), (3, 'bbc'), (4, 'ABD');
INSERT INTO collate_test2 (a,b) SELECT a,b FROM collate_test1;
SELECT a, b FROM collate_test2 WHERE a < 4 INTERSECT SELECT a, b FROM collate_test2 WHERE a > 1 ORDER BY 2;
 a |  b  
---+-----
 2 | Abc
 3 | bbc
(2 rows)

-- bug 37
CREATE TABLE moneyp (a money) PARTITION BY LIST (a);
CREATE TABLE moneyp_10 PARTITION OF moneyp FOR VALUES IN (10);
ERROR:  specified value cannot be cast to type money for column "a"
LINE 1: ...EATE TABLE moneyp_10 PARTITION OF moneyp FOR VALUES IN (10);
                                                                   ^
DETAIL:  The cast requires a non-immutable conversion.
HINT:  Try putting the literal value in single quotes.
drop table if exists list_parted;
NOTICE:  table "list_parted" does not exist, skipping
CREATE TABLE list_parted (a int) PARTITION BY LIST (a);
CREATE TABLE part_1 PARTITION OF list_parted FOR VALUES IN ('1');
CREATE TABLE fail_part PARTITION OF list_parted FOR VALUES IN (int '1');
ERROR:  syntax error at or near "int"
LINE 1: ... fail_part PARTITION OF list_parted FOR VALUES IN (int '1');
                                                              ^
CREATE TABLE fail_part PARTITION OF list_parted FOR VALUES IN ('1'::int);
ERROR:  syntax error at or near "::"
LINE 1: ...fail_part PARTITION OF list_parted FOR VALUES IN ('1'::int);
                                                                ^
-- bug 72
drop table if exists onek;
NOTICE:  table "onek" does not exist, skipping
CREATE TABLE onek (
    unique1 int4,
    unique2 int4,
    two int4,
    four int4,
    ten int4,
    twenty int4,
    hundred int4,
    thousand int4,
    twothousand int4,
    fivethous int4,
    tenthous int4,
    odd int4,
    even int4,
    stringu1 name,
    stringu2 name,
    string4 name
);
CREATE UNIQUE INDEX onek_idx ON onek (unique2 nulls first,unique1);
-- bug 34
drop table if exists part_attmp cascade;
NOTICE:  table "part_attmp" does not exist, skipping
CREATE TABLE part_attmp (a int primary key) partition by range (a);
CREATE TABLE part_attmp1 PARTITION OF part_attmp FOR VALUES FROM (0) TO (100);
ALTER INDEX part_attmp_pkey RENAME TO part_attmp_index;
ALTER INDEX part_attmp1_pkey RENAME TO part_attmp1_index;
alter table part_attmp add column b int;
create index part_attmp_b_idx on part_attmp(b);
ALTER INDEX part_attmp_b_idx RENAME TO part_attmp_b_index;
ALTER INDEX part_attmp1_b_idx RENAME TO part_attmp1_b_index;
-- bug 14
drop table if exists test_default_tab cascade;
NOTICE:  table "test_default_tab" does not exist, skipping
CREATE TABLE test_default_tab(pk serial primary key, id int);
CREATE INDEX test_index1 on test_default_tab (id);
ALTER TABLE test_default_tab ALTER id TYPE bigint;
drop table if exists anothertab cascade;
NOTICE:  table "anothertab" does not exist, skipping
create table anothertab(f1 int primary key, f2 int unique,f3 int, f4 int, f5 int);
alter table anothertab add unique(f1,f4);
create index on anothertab(f2,f3);
create unique index on anothertab(f4);
alter table anothertab alter column f1 type bigint;
alter table anothertab
    alter column f2 type bigint,
    alter column f3 type bigint,
    alter column f4 type bigint;
create table at_partitioned(id int primary key, name varchar(64), unique (id, name)) partition by hash(id);
create table at_partitioned_1 partition of at_partitioned for values with (modulus 2, remainder 1);
alter table at_partitioned alter column name type varchar(127);
-- bug 24 this doesn't pass now. we have to disable DEFAULT partitions now.
-- drop table if exists range_parted2 cascade;
--  CREATE TABLE range_parted2 (a int primary key) PARTITION BY RANGE (a);
-- CREATE TABLE range2_default PARTITION OF range_parted2 DEFAULT;
-- INSERT INTO range_parted2 VALUES (85);
-- CREATE TABLE fail_part PARTITION OF range_parted2 FOR VALUES FROM (80) TO (90);
-- CREATE TABLE part4 PARTITION OF range_parted2 FOR VALUES FROM (90) TO (100);
-- 
-- 
-- drop table if exists pc_list_parted cascade;
-- create table pc_list_parted (a int primary key) partition by list(a);
-- create table pc_list_part_1 partition of pc_list_parted for values in (1);
-- create table pc_list_part_2 partition of pc_list_parted for values in (2);
-- create table pc_list_part_def partition of pc_list_parted default;
-- create table pc_list_part_3 partition of pc_list_parted for values in (3);
-- 
-- drop table if exists quuux cascade;
-- CREATE TABLE quuux (a int primary key, b text) PARTITION BY LIST (a);
-- CREATE TABLE quuux_default PARTITION OF quuux DEFAULT PARTITION BY LIST (b);
-- CREATE TABLE quuux_default1 PARTITION OF quuux_default FOR VALUES IN ('b');
-- CREATE TABLE quuux1 (a int, b text);
-- ALTER TABLE quuux ATTACH PARTITION quuux1 FOR VALUES IN (1);
-- CREATE TABLE quuux2 (a int, b text);
-- ALTER TABLE quuux ATTACH PARTITION quuux2 FOR VALUES IN (2);
-- DROP TABLE quuux1;
-- DROP TABLE quuux2;
-- CREATE TABLE quuux1 PARTITION OF quuux FOR VALUES IN (1);
-- CREATE TABLE quuux2 PARTITION OF quuux FOR VALUES IN (2);
-- bug 62 this doesn't pass now. we have to disable 'ALTER TABLE ... ATTACH PARTITION' now.
-- CREATE TABLE list_parted2 (a int,b char) PARTITION BY LIST (a);
-- CREATE TABLE part_2 (LIKE list_parted2);
-- INSERT INTO part_2 VALUES (3, 'a');
-- ALTER TABLE list_parted2 ATTACH PARTITION part_2 FOR VALUES IN (2);
--
-- bug 56
drop table if exists pc_list_parted  cascade;
NOTICE:  table "pc_list_parted" does not exist, skipping
create table pc_list_parted (a int primary key) partition by list(a);
create table pc_list_part_null partition of pc_list_parted for values in (null);
create table pc_list_part_1 partition of pc_list_parted for values in (1);
insert into pc_list_part_1 values(2);
ERROR:  new row for relation "pc_list_part_1" violates partition constraint
DETAIL:  Failing row contains (2).
-- bug 25
drop table if exists concur_heap;
NOTICE:  table "concur_heap" does not exist, skipping
CREATE TABLE concur_heap (id serial primary key, f1 int, f2 int);
insert into concur_heap (f1, f2) values(2,3),(3,5),(5,7),(7,11);
CREATE INDEX CONCURRENTLY concur_index1 ON concur_heap(f2,f1);
select*from concur_heap;
 id | f1 | f2 
----+----+----
  1 |  2 |  3
  2 |  3 |  5
  3 |  5 |  7
  4 |  7 | 11
(4 rows)

-- bug 110
drop table if exists INT8_TBL cascade;
CREATE TABLE INT8_TBL(q1 int8, q2 int8);
INSERT INTO INT8_TBL VALUES(' 123 ',' 456');
INSERT INTO INT8_TBL VALUES('123 ','4567890123456789');
INSERT INTO INT8_TBL VALUES('4567890123456789','123');
INSERT INTO INT8_TBL VALUES(+4567890123456789,'4567890123456789');
INSERT INTO INT8_TBL VALUES('+4567890123456789','-4567890123456789');
create view tt17v as select * from int8_tbl i where i in (values(i));
select * from tt17v;
        q1        |        q2         
------------------+-------------------
              123 |               456
              123 |  4567890123456789
 4567890123456789 |               123
 4567890123456789 |  4567890123456789
 4567890123456789 | -4567890123456789
(5 rows)

-- bug 111
drop table if exists persons;
NOTICE:  table "persons" does not exist, skipping
drop type if exists person_type cascade;
NOTICE:  type "person_type" does not exist, skipping
CREATE TYPE person_type AS (id int, name varchar(50));
CREATE TABLE persons OF person_type;
ERROR:  Kunlun-db: The way of creating a table not supported.
-- bug 112
drop table if exists base_tbl cascade;
NOTICE:  drop cascades to view rw_view1
drop view if existrs rw_view1;
ERROR:  syntax error at or near "existrs"
LINE 1: drop view if existrs rw_view1;
                     ^
CREATE TABLE base_tbl (a int, b int DEFAULT 10);
INSERT INTO base_tbl VALUES (1,2), (2,3), (1,-1);
CREATE VIEW rw_view1 AS SELECT * FROM base_tbl WHERE a < b WITH LOCAL CHECK OPTION;
WARNING:  views with CHECK options are not supported, the view will be created but the check constraints will be ignored silently.
INSERT INTO rw_view1 values(3,2),(4,3), (3,4);
-- bug 114
drop table if exists update_test;
NOTICE:  table "update_test" does not exist, skipping
CREATE TABLE update_test (a INT DEFAULT 10, b INT, c TEXT);
INSERT INTO update_test VALUES (5, 10, 'foo');
INSERT INTO update_test(b, a) VALUES (15, 10);
UPDATE update_test t SET (a, b) = (SELECT b, a FROM update_test s WHERE s.a = t.a) WHERE CURRENT_USER = SESSION_USER;
ERROR:  Kunlun-db: Can't access system attribute(ctid) from remote tables.
-- bug 116
drop table if exists t1;
NOTICE:  table "t1" does not exist, skipping
create table t1(pk int not null primary key);
ALTER TABLE t1 ADD COLUMN c_num NUMERIC DEFAULT 1.00000000001;
insert into t1 values(1),(2),(3),(4),(5);
select * from t1;
 pk |         c_num          
----+------------------------
  1 | 1.00000000001000000000
  2 | 1.00000000001000000000
  3 | 1.00000000001000000000
  4 | 1.00000000001000000000
  5 | 1.00000000001000000000
(5 rows)

-- bug 126
drop table if exists t1;
create table t1(a int);
insert into t1 values(1),(2),(3);
update t1 set a=3 returning *;
 a 
---
 3
 3
(2 rows)

delete from t1 returning *;
 a 
---
 3
 3
 3
(3 rows)

-- bug 127
-- TODO: verify the stmt is sent to ddl log after each ddl stmt. so far we don't have such test facility.
DROP SCHEMA if exists testschema cascade;
NOTICE:  schema "testschema" does not exist, skipping
CREATE SCHEMA testschema;
CREATE TABLE testschema.part0 (a int) PARTITION BY LIST (a);
drop table testschema.part0;
CREATE TABLE testschema.part1 (a serial primary key, b int, c varchar(32), unique (b,a)) PARTITION BY LIST (a);
create index part1_b_c2 on testschema.part1(b,c);
create table testschema.part1_0 partition of testschema.part1 for values in (1,2,3,4);
create table testschema.part1_1 partition of testschema.part1 for values in (5,6,7,8);
insert into testschema.part1 (b,c) values(14, 'def'),(15,'efg'),(16,'fgh');
select*from testschema.part1 ;
 a | b  |  c  
---+----+-----
 1 | 14 | def
 2 | 15 | efg
 3 | 16 | fgh
(3 rows)

create index part1_b_c on testschema.part1(b,c);
insert into testschema.part1 (b,c) values(17, 'ghi'),(18,'hij'),(19,'ijk');
select*from testschema.part1 ;
 a | b  |  c  
---+----+-----
 1 | 14 | def
 2 | 15 | efg
 3 | 16 | fgh
 4 | 17 | ghi
 5 | 18 | hij
 6 | 19 | ijk
(6 rows)

drop index testschema.part1_b_c;
insert into testschema.part1 (b,c) values(11, 'abc'),(12,'bcd'),(13,'cde');
ERROR:  no partition of relation "part1" found for row
DETAIL:  Partition key of the failing row contains (a) = (9).
select*from testschema.part1 ;
 a | b  |  c  
---+----+-----
 1 | 14 | def
 2 | 15 | efg
 3 | 16 | fgh
 4 | 17 | ghi
 5 | 18 | hij
 6 | 19 | ijk
(6 rows)

drop schema testschema cascade;
NOTICE:  drop cascades to table testschema.part1
-- bug 121
drop table if exists indext1;
NOTICE:  table "indext1" does not exist, skipping
create table indext1(id integer);
ALTER TABLE indext1 ADD CONSTRAINT oindext1_id_constraint UNIQUE (id);
ALTER TABLE indext1 DROP CONSTRAINT oindext1_id_constraint;
CREATE TABLE part1 (a serial primary key, b int, c varchar(32), unique (b,a)) PARTITION BY LIST (a);
create index part1_b_c2 on part1(b,c);
create table part1_0 partition of part1 for values in (1,2,3,4);
insert into part1 (b,c) values(11, 'abc'),(12,'bcd'),(13,'cde');
select*from part1;
 a | b  |  c  
---+----+-----
 1 | 11 | abc
 2 | 12 | bcd
 3 | 13 | cde
(3 rows)

ALTER TABLE part1 ADD CONSTRAINT opart1_c_constraint UNIQUE (c,a);
create table part1_1 partition of part1 for values in (5,6,7,8);
insert into part1 (b,c) values(14, 'def'),(15,'efg'),(16,'fgh');
alter table part1 add column d int not null;
select*from part1;
 a | b  |  c  | d 
---+----+-----+---
 1 | 11 | abc | 0
 2 | 12 | bcd | 0
 3 | 13 | cde | 0
 4 | 14 | def | 0
 5 | 15 | efg | 0
 6 | 16 | fgh | 0
(6 rows)

create table part1_2 partition of part1 for values in (9,10,11,12);
insert into part1 (b,c,d) values(17, 'ghi', 21),(18,'hij',22),(19,'ijk',23);
select*from part1;
 a | b  |  c  | d  
---+----+-----+----
 1 | 11 | abc |  0
 2 | 12 | bcd |  0
 3 | 13 | cde |  0
 4 | 14 | def |  0
 5 | 15 | efg |  0
 6 | 16 | fgh |  0
 7 | 17 | ghi | 21
 8 | 18 | hij | 22
 9 | 19 | ijk | 23
(9 rows)

ALTER TABLE part1 ADD CONSTRAINT opart1_b_constraint UNIQUE (b,a);
create table part1_3 partition of part1 for values in (13,14,15,16);
insert into part1 (b,c,d) values(20, 'jkl', 24),(21,'klm',25),(22,'lmn',26);
ALTER TABLE part1 ADD CONSTRAINT opart1_d_constraint UNIQUE (d,a);
ALTER TABLE part1 DROP CONSTRAINT opart1_c_constraint;
ALTER TABLE part1 DROP CONSTRAINT opart1_d_constraint;
ALTER TABLE part1 DROP CONSTRAINT opart1_b_constraint;
drop index part1_b_c2;
drop table part1;
